orig_pred,contrast_pred,orig_premise,orig_hypothesis,gen_premise,gen_hypothesis,pred_orig_labels,pred_gen_premise_labels,pred_gen_hypothesis_labels,distance_premise,distance_hypothesis,perplexity_gen_hypothesis,perplexity_gen_premise,orig_contrast_probs,pred_edit_premise_probs,pred_edit_hypo_probs,diff_premise_probs,diff_hypothesis_probs
entailment,neutral,"While traveling, a woman in a black jacket is resting on the shoulder of a man in a black jacket.",A woman rests on the shoulder of a man,"  Looking up,   a woman in   hat and jacket   holds hands with parts of   lone man in glasses.",A  woman rests on  the shoulder of a husband,1,2,2,0.7727272727272727,0.3333333333333333,42.4034538269043,89.50560760498047,0.03549190238118172,0.5380126237869263,0.9947596192359924,0.5025207214057446,0.9592677168548107
neutral,entailment,"A small, pale bird bends down to examine a crumb.",The bird is on the ground.,"A small,  nocturnal bird bends down  to examine its crumb.",The bird is on  the ground. Looks,2,2,2,0.3333333333333333,0.2857142857142857,100.8475341796875,126.25462341308594,0.19585460424423218,0.6039734482765198,0.38762331008911133,0.039036452770233154,-0.1773136854171753
entailment,neutral,A man riding a motorcycle on a dirt road passing several junk or abandoned cars on the side of the road.,A man is riding a motorcyle.,A  person riding  a motorcycle on  s dirt road passing  by junk or stolen cars on the side of the road.,A man is  riding a  chevy motorcycle,1,2,2,0.36363636363636365,0.5714285714285714,73.91837310791016,75.6186294555664,0.0116953793913126,0.8488040566444397,0.9987916350364685,0.8371086772531271,0.9870962556451559
entailment,neutral,A skier is heading into a grove of trees.,There is snow on the ground in this picture.,  Photographer  zooms into  a graffti amid trees., There is  a light snow on the ground in this picture.,1,0,2,0.7,0.4,76.56163787841797,217.5455322265625,0.062244266271591187,0.7402300834655762,0.8875391483306885,0.7390883227344602,0.8252948820590973
neutral,entailment,Two women bend over to touch a small kangaroo.,Two women are petting a kangaroo, Two women bend  over to touch a petting kangaroo.,Two women are  touching a kangaroo,2,1,1,0.3,0.3333333333333333,70.04302978515625,92.5805435180664,0.149581640958786,0.8979049921035767,0.9747963547706604,0.7483233511447906,0.8252147138118744
entailment,neutral,A man with thinning hair looking into glasses through glasses.,A man with thinning hair.,A man  with black hair looking into glasses through glasses.,A man with thinning black hair.,1,2,2,0.18181818181818182,0.16666666666666666,34.52553176879883,131.95639038085938,0.017447737976908684,0.877723753452301,0.9983248114585876,0.8602760154753923,0.980877073481679
neutral,contradiction,A kid dressed in a long-sleeve shirt with a jersey numbered 11 is passing a bar to a boy in a jersey numbered 12 during a relay race.,A team of youths race to finish first in a relay race on a beach., A kid dressed in a long-sleeve shirt with  the jersey numbered 11  is passing  a bar to  thomas the boy in  the  bleachers during he race.,A  dog returns to  his friend in a relay race on foot,2,2,0,0.45161290322580644,0.625,125.9336166381836,137.7935333251953,0.0022043397184461355,0.5035592317581177,0.9996830224990845,-0.4934910535812378,0.9974786827806383
entailment,neutral,A man is riding a bicycle in the street.,a bicycle is being ridden, A man  holding  a bicycle in the street.,a bicycle is  wearingjeans,1,0,2,0.4,0.4,123.80012512207031,388.8866271972656,0.03666221722960472,0.7209550738334656,0.9874157309532166,0.720349681796506,0.9507535137236118
entailment,neutral,A woman with a pink purse walks down a crowded sidewalk.,A woman walks through a crowd,A woman with a pink purse walks down  an urban sidewalk.,A woman  walks through a city,1,2,2,0.25,0.3333333333333333,94.66510009765625,158.20457458496094,0.0654568076133728,0.9915810227394104,0.9595591425895691,0.9261242151260376,0.8941023349761963
entailment,neutral,"A large number of people are watching men dressed in kilts, one of whom has thrown a long pole.",people watch men in kilts,"A large number  of people  are dressed  in  kilts, one of whom has thrown a long pole.",people watch men in kilts laughing,1,1,2,0.2857142857142857,0.2,62.1797981262207,159.4257049560547,0.006861657835543156,0.5580688714981079,0.9927793145179749,-0.4349159002304077,0.9859176566824317
entailment,neutral,"Two babies, one in red, asleep in their highchairs.",babies are asleep,-1,babies are sleepwalking,1,0,2,1.0,0.3333333333333333,178.9256134033203,1688.174560546875,0.017860744148492813,0.9903046488761902,0.7412261366844177,0.9893881126190536,0.7233653925359249
neutral,entailment,Some folks pick out the food they want at a party.,The party-goers are perusing the buffet., A buffet table filled with choices of pick out  what food they want at a party.,The party guests decide what togo with the buffet.,2,1,1,0.8333333333333334,0.5555555555555556,91.58187866210938,107.44422912597656,0.4132329225540161,0.9545168280601501,0.6180168986320496,0.541283905506134,0.20478397607803345
entailment,neutral,A small dog runs to catch a ball.,A little dog chases a ball.,A  dog runs  to catch a ball.,A  brown dog chases a ball.,1,2,2,0.2222222222222222,0.2857142857142857,86.1585922241211,143.5729217529297,0.018527938053011894,0.9010614156723022,0.9986487030982971,0.8825334776192904,0.9801207650452852
entailment,neutral,A white and black spotted dog is running through a grassy area.,A dog is outdoors.,A white and   black dog looks at   something through his area., A dog is outdoors with people,1,2,2,0.6153846153846154,0.6,141.17916870117188,224.48660278320312,0.026726577430963516,0.5941033363342285,0.9807887673377991,0.567376758903265,0.9540621899068356
entailment,neutral,The black woman is laying out literature.,A black woman is handling printed material., A woman  is handling printed literature.,A scribe is handling printed material.,1,2,2,0.625,0.25,166.3915252685547,243.97158813476562,0.006034820806235075,0.9991579055786133,0.9032841324806213,0.9931230847723782,0.8972493116743863
entailment,neutral,Island native fishermen reeling in their nets after a long day's work.,The men are finishing their day of work.,Island  fishers reeling in their nets after a long day's work.,The men are finishing  their long day of work.,1,2,1,0.14285714285714285,0.2222222222222222,147.8324432373047,129.65675354003906,0.09268184751272202,0.6295837759971619,0.8697468042373657,0.5369019284844398,-0.03146904706954956
entailment,neutral,a dog jumps over the pole.,dog is jumping over a pole,-1, A gray dog is jumping over a pole,1,0,2,1.0,0.5,92.77738189697266,315.3689270019531,0.04130830243229866,0.9148402810096741,0.9992245435714722,0.9141581515432335,0.9579162411391735
entailment,neutral,A man running in a race passes by spectators.,A man is running by people who are watching.,A  person running in  marathon passes by spectators., A man is running by his followers who are watching.,1,2,1,0.4,0.3,171.722900390625,167.30335998535156,0.01632549986243248,0.6062905788421631,0.655751645565033,0.5899650789797306,-0.32681673765182495
neutral,entailment,A man talks to two guards as he holds a drink.,The prisoner is talking to two guards in the prison cafeteria.,A  prisoner talks  to two guards  in  prison cafeteria having a drink., A  man  is inside the building talking to two guards while holding something,2,1,1,0.75,1.0833333333333333,136.74188232421875,83.99369812011719,0.00730911735445261,0.9718989729881287,0.6759076714515686,0.964589855633676,0.668598554097116
neutral,contradiction,A woman with a black purse and a red coat is sitting on a pillar of concrete.,The woman is waiting for her boyfriend at the local bus stop., A woman with  a purse and   shoes  walks down   some steps into the camera.,The woman is waiting for  the bus..........................................!...............................,2,0,2,0.7777777777777778,0.5384615384615384,84.78768157958984,85.0816650390625,0.002034260891377926,0.7653229832649231,0.8603183627128601,0.7632887223735452,-0.13661986589431763
neutral,contradiction,"One man wearing a pink and blue striped shirt, work gloves, and holding a yellow hard hat.",A tall person in a shirt," A short person wearing  a pink  sleeveless  t- shirt, gloves, and holding a straw hat.",A tall person in a green shirt,2,0,2,0.6,0.16666666666666666,43.0008544921875,88.7005615234375,0.0012479221913963556,0.9940816760063171,0.635968804359436,0.9928337538149208,-0.3623722791671753
neutral,entailment,A barber in a sports themed barber shop waits for his next customer to arrive.,A barber in a sports shop waits eagerly for business.,A barber in a sports themed barber  shop waits for his  eager customer to arrive.,A barber in a sports shop waits for his customer.e,2,1,1,0.1875,0.2727272727272727,68.79753112792969,191.8710479736328,0.06838808953762054,0.45366358757019043,0.9809744954109192,0.3852754980325699,0.9125864058732986
neutral,contradiction,"Boy in backpack crossing the street, Other people, all Asian, are all in crosswalk walking towards the boy.",The boy is on his way home from school.,-1, A boy sits on his couch coming home from school.,2,0,0,1.0,0.5,173.30047607421875,33.25593185424805,0.001358815934509039,0.5500231385231018,0.9999043941497803,0.5486643225885928,0.9985455782152712
neutral,entailment,The cyclist rides on a wooded path.,The cyclist rides with a companion on a wooded path,The cyclist rides on his companion on wooded path., The cyclist rides on a wooded path,2,1,1,0.375,0.4,23.75316047668457,39.8460578918457,0.009739033877849579,0.9647257924079895,0.9524742960929871,0.9549867585301399,0.9427352622151375
neutral,contradiction,a woman working in the storefront of a jewelry shop fixing the display shelf.,The woman is dreaming of a modeling career while working in the jewelry shop.,a  woman working in the storefront of  a jewelry  shop fixing items on shelf.,The  woman is dreaming  about a modeling career while working in the jewelry shop.,2,0,0,0.3333333333333333,0.2,90.48233032226562,100.0691146850586,0.42412611842155457,0.7131495475769043,0.8900077939033508,0.28902342915534973,0.46588167548179626
neutral,entailment,Two people play horseshoes.,Tom and Sue were playing outside., Tom and Sue play outside with horseshoes., There are people playing outside.,2,1,1,1.2,0.5714285714285714,178.59710693359375,81.92800903320312,0.12733285129070282,0.7839860320091248,0.6442582011222839,0.6566531807184219,0.5169253498315811
neutral,entailment,Two adult men in black t-shirt and loud tunics hold smoking torches in preparation for an act of entertainment or celebration in a forested environment.,Two brothers hold torches to celebrate.,   Two men in  blue tuxedos and  tunic  hold torches   up for   a celebration in  an honor act with their brother.,Two  men hold torches to celebrate.,2,1,1,0.8214285714285714,0.2857142857142857,130.5028533935547,102.22285461425781,0.0010049414122477174,0.9260091185569763,0.9726549386978149,0.9250041771447286,0.9716499972855672
neutral,entailment,Several adults look on while a young girl plays in a ball pit.,A young girl is having fun., Five adults stand and look on while  a young girl smiles and plays in the pit.,A young girl is having fun outside.,2,1,1,0.6428571428571429,0.14285714285714285,38.77991485595703,111.5096206665039,0.20331993699073792,0.538843035697937,0.6379091739654541,0.3355230987071991,0.4345892369747162
neutral,entailment,A girl climbing a chain link fence.,The girl climbs the fence to get to school., Girl climbing up to school fence.,-1,2,1,0,0.625,1.0,132.21475219726562,44.50238800048828,0.0008450944442301989,0.9304707646369934,0.9413385987281799,0.9296256701927632,0.9405713495798409
neutral,contradiction,A man biking down a tunnel.,A man is winning a bike race., Woman biking down a tunnel., A girl is winning a bike race.,2,0,0,0.2857142857142857,0.25,162.38694763183594,147.0784912109375,0.005933580454438925,0.9980208873748779,0.9991650581359863,0.992087306920439,0.9932314776815474
neutral,contradiction,"A smiling man with gray hair and glasses, dressed in black, is sitting in a chair with a music stand in front of him.",This man has an eyesight deficiency.,-1,This man has an eyesight apnea.,2,2,0,1.0,0.14285714285714285,23.387142181396484,161.90240478515625,0.30834487080574036,0.9505245089530945,0.9295948147773743,0.2775813341140747,0.6212499439716339
neutral,contradiction,Three children are shooting guns in the woods.,Three children are shooting a deer., Three children  shooting corn out in the woods.,Three children  are feeding a deer.,2,0,0,0.4444444444444444,0.2857142857142857,142.10400390625,327.8612976074219,0.0037361206486821175,0.9927812218666077,0.9968487620353699,0.9890451012179255,0.9931126413866878
neutral,entailment,Four people wearing backpacks walking in a line along a mountain trail.,Four people are walking along a mountain trail trying to get down before the storm.,"Four  people backpacking before  a storm, along s mountain trail.",-1,2,2,0,0.6153846153846154,1.0,157.7574920654297,129.69607543945312,0.001523189595900476,0.7454606294631958,0.9947459697723389,-0.25263696908950806,0.9943667220650241
neutral,entailment,Several people talk and drink beer while sitting around a picnic table.,Several friends talk and drink beer while sitting around a picnic table., Several friends talk  and drink beer while sitting around a picnic table., Several people talk and drink beer while  sitting around a picnic table.,2,1,1,0.23076923076923078,0.23076923076923078,33.7565803527832,24.679523468017578,0.01397522073239088,0.922295093536377,0.9278209209442139,0.9083198728039861,0.913845700211823
entailment,neutral,A smiling girl slides down a purple slide feet first.,A girl happily uses the equipment at a playground., A smiling  girl slides down a swing seven feet first.,A girl happily  slide down the equipment at a playground.,1,2,2,0.36363636363636365,0.3,369.0932922363281,415.7613220214844,0.4264247715473175,0.648637592792511,0.9271636605262756,0.22221282124519348,0.5007388889789581
neutral,entailment,A man in a purple and blue shirt and shorts is getting ready to hit a golf ball.,A man is on a golf course.,A man in a purple and blue shirt  and shorts is  golfing getting ready  to hit the ball., A man on a golf course.,2,1,1,0.3157894736842105,0.25,48.71009063720703,67.8067626953125,0.4589954912662506,0.8105658292770386,0.5468747019767761,0.35157033801078796,0.08787921071052551
neutral,contradiction,A man is performing for a group in front of a white house.,The man performed in front of his own house.,A man  performs for  a group  in front of santas house.,The man performed in front of his own black house.,2,0,0,0.42857142857142855,0.1,26.440013885498047,88.49903869628906,0.07745150476694107,0.9284715056419373,0.9986096620559692,0.8510200008749962,0.9211581572890282
neutral,contradiction,A young man is playing a blue guitar.,A musician practices on his guitar briefly before a concert.,  Spectators Are Consc., A old man practices on his guitar briefly before a concert.,2,0,0,0.8888888888888888,0.2727272727272727,158.025146484375,405.4897155761719,0.0005828108405694366,0.9960008263587952,0.9986709356307983,0.9954180155182257,0.9980881247902289
neutral,entailment,Two men help each other cut a sheet of plastic.,Two friends help each other by cutting some plastic., Two friends help each  other cut a sheet of plastic., Two people help each  other by cutting some plastic.,2,1,1,0.2727272727272727,0.3,175.92843627929688,130.99781799316406,0.05535174161195755,0.9705457091331482,0.974821150302887,0.9151939675211906,0.9194694086909294
neutral,entailment,An old man in a blue shirt and white pants glowers by a glass door.,A man resting outside,An old man in a blue shirt and white pants rests on strollers by a glass door., glimming outside,2,1,1,0.1875,0.75,200.49404907226562,65.31997680664062,0.2637862265110016,0.6716429591178894,0.7052876949310303,0.4078567326068878,0.4415014684200287
neutral,entailment,"A little girl drawing with chalk, on a chalkboard.",A little girl is drawing on the board during class.,"A little girl drawing with chalk, on a class chalkboard.",-1,2,1,0,0.09090909090909091,1.0,91.66248321533203,49.48585510253906,0.01783503033220768,0.7641777396202087,0.961168110370636,0.7463427092880011,0.9609384264622349
neutral,entailment,a wet golden retriever is walking through a lake,A wet golden retriever is walking through a lake to find a ball.,-1,-1,2,0,0,1.0,1.0,220.53968811035156,116.4063720703125,0.00048557488480582833,0.9989622831344604,0.9793140292167664,0.9986403977964073,0.9789921438787133
neutral,contradiction,A woman is sitting down doing some sort of craft work while another person operates a large wooden loom device in the background.,The woman sitting is asian., A woman  of African descent is sitting down doing  some sort  of work while  another woman operates a  whiz - device in the background.,The woman sitting is asian saxophone,2,0,0,0.5416666666666666,0.16666666666666666,101.14582824707031,143.82618713378906,0.0026212281081825495,0.9980911612510681,0.7709996700286865,0.9954699331428856,0.768378441920504
neutral,entailment,People in chairs around a table,The people are eating dinner.,People  eating dinner in chairs around a table, The people are sitting down.,2,1,1,0.5,0.5,238.43434143066406,192.11622619628906,0.008526017889380455,0.9924218058586121,0.8487077355384827,0.9838957879692316,0.8401817176491022
entailment,neutral,A performer plays an instrument for the audience.,The performer is making music.,  Actor performs for an audience.,The performer is a singer.,1,2,2,0.6666666666666666,0.3333333333333333,34.620697021484375,244.89317321777344,0.010238866321742535,0.5969150066375732,0.9971617460250854,0.5866761403158307,0.9869228797033429
neutral,entailment,A group of people wait to cross the street in new york,Some of the people are wearing sunglasses.,A group of  sunglasses wearing people wait to cross the street in new york, Some  of the people  are waitings,2,1,1,0.25,0.75,163.63418579101562,95.69392395019531,0.0007777107530273497,0.9318569302558899,0.5234068632125854,0.9310792195028625,0.5226291524595581
neutral,entailment,"Two distinguished older gentlemen stand outside a house, trees in background, both with white hair, the taller man having his arm about the other man's shoulder as they face the camera from behind their corrective lenses.",The older men are colleagues.," Two older men who are colleagues, one stand outside  a house with trees  in background, both with  gray hair,  one is having his arm about the  other man's shoulder  and his face  in front of the camera from behind  with lenses pointed up",The older men are outdoors.,2,1,1,0.6829268292682927,0.16666666666666666,78.99263763427734,115.9098129272461,0.0009850446367636323,0.7558651566505432,0.9934394955635071,0.7548801120137796,0.9924544509267434
neutral,contradiction,A young woman dressed in black attaches bags full of flowers to a bicycle.,The flowers are lilacs.,A young  woman dressed  in pink attaches her bicycle to a bicycle., The flowers  are all lilacs!.................................,2,0,0,0.4666666666666667,1.0,177.77218627929688,382.6058349609375,0.0016267995815724134,0.9943577647209167,0.7834504842758179,0.9927309651393443,0.7818236846942455
neutral,contradiction,"A man stands on a dock near several boats, while 2 other men are on one of the boats.",A man with brown hair is standing on a dock.,"A man stands on  redheaded mane near  some boats, while 2 other men are on one of the boats.",A man  with brown hair is  sitting on a dock,2,0,0,0.23809523809523808,0.36363636363636365,53.293739318847656,70.14781188964844,0.0006232866435311735,0.9752978682518005,0.7854859232902527,0.9746745816082694,0.7848626366467215
neutral,entailment,A bird is perched on a line of some sort attached to a pole.,A bird is wallowing on a pole., A bird  wallowing on  a line of  netting attached to dangling pole.,A bird is wilng on a pole,2,1,1,0.4666666666666667,0.25,45.634822845458984,178.15719604492188,0.01881091110408306,0.9883699417114258,0.9604980945587158,0.9695590306073427,0.9416871834546328
neutral,entailment,A person is on a four wheeler kicking up a lot of dirt in a dune.,The person is in a race.,A person is on a four wheeler kicking up a lot of dirt in a race or dune.,A person is  in a dune,2,1,1,0.11764705882352941,0.5714285714285714,49.86874771118164,51.375484466552734,0.0022070861887186766,0.7545436024665833,0.9069901704788208,0.7523365162778646,0.9047830842901021
neutral,contradiction,"A man wearing an oxford shirt, sunglasses, and a hat smirks.",A man hiding his true identity.,"A man wearing  an oxford shirt, sunglasses, and  a plethora of  necklaces is making",A man hiding his  true identity. Then crying,2,0,0,0.5714285714285714,0.42857142857142855,136.66046142578125,134.27210998535156,0.01962500810623169,0.6692620515823364,0.999518632888794,0.6496370434761047,0.9798936247825623
entailment,neutral,A group of people gathered at night watching an event.,A group of humans are looking at the same direction.,-1, A group  of friends are going in the same direction.,1,1,2,1.0,0.45454545454545453,121.19316101074219,90.08914184570312,0.004661102779209614,0.8233258724212646,0.6355412602424622,-0.1715957522392273,0.6308801574632525
neutral,contradiction,A man in a suit cheering in a library in front of children.,A lawyer is encouraging some children at a contest.,A man in  protesting in  a library in front of children.,A lawyer  is encouraging her children at a contest.,2,0,0,0.2857142857142857,0.2,235.473388671875,273.2079772949219,0.01904122717678547,0.9316740036010742,0.7484045624732971,0.9126327764242887,0.7293633352965117
neutral,entailment,Security officer working outside.,A security officer is dressed in a uniform.," Security officer in uniform, working outside."," Someone is outside, dressed in a uniform.",2,1,1,0.8,0.5555555555555556,216.06336975097656,61.56763458251953,0.040110256522893906,0.9792560338973999,0.7284155488014221,0.939145777374506,0.6883052922785282
neutral,entailment,A man in a white and gray shirt looks on as a shirtless man with a mustache cleans fish on a pale green table.,The man is cleaning the fish that he caught so he can cook it.,A man in a white  shirt looks  on as  a man with  some fish stands by on  the table washing his catch for cooking,The man   is placing fish  on the   table so  he can clean it,2,2,1,0.72,0.7333333333333333,68.1248550415039,111.23734283447266,0.0004716208204627037,0.723027229309082,0.561942994594574,-0.27608710527420044,0.5614713737741113
neutral,contradiction,A young couple and many others out enjoying themselves at an outdoor street event.,The young couple are looking at goods being sold by the street vendors.,A young couple  with many others  crowding around at an event.,The young couple are  frowning at goods being sold by the street vendors.,2,0,0,0.4666666666666667,0.14285714285714285,81.15774536132812,82.40812683105469,0.05348697677254677,0.856877863407135,0.9997071623802185,0.8033908866345882,0.9462201856076717
neutral,entailment,Construction workers use cables to hang from the sides of buildings.,Construction workers are brave.,  Three men  use cables  to hang from  the sides   of buildings saving their lives.,Construction workers are hanging.,2,1,1,0.8333333333333334,0.2,93.22350311279297,249.5803985595703,0.02966582588851452,0.8237321376800537,0.9685121178627014,0.7940663117915392,0.9388462919741869
neutral,entailment,A dark-haired man in a black uniform is speaking to a man wearing a black jacket and black helmet on a motorbike.,A man in a police uniform is talking to another man.,A dark-haired man in a  police uniform is speaking to a man wearing a black jacket and black helmet on a motorbike.,A man  in a  uniform is talking to  another man on,2,1,1,0.08,0.3333333333333333,35.90126037597656,27.102678298950195,0.008008267730474472,0.9829005599021912,0.9764575362205505,0.9748922921717167,0.9684492684900761
neutral,entailment,A woman wearing a red coat stands on a wood floor in front of several paintings while two girls sit on the floor at her feet.,Woman takes a break at a museum while her children sit by her feet.," A woman wearing a red coat stands on  the floor  in front  of museum, while  her two children sit on  bench at her feet.", Lady takes  a break   from standing in front of several paintings as  three of her companions sit nearby,2,2,2,0.4444444444444444,1.2,55.722251892089844,54.72012710571289,0.0046702357940375805,0.5830096006393433,0.511023998260498,-0.4118698835372925,-0.4838554859161377
contradiction,neutral,a climber wearing a red headband is pulling himself up some gray rocks high above some green foliage.,A climber pulls himself up 5000 feet up over a forest,a climber wearing a red headband is pulling himself up some gray rocks high above some high foliage.,A professional climber pulls himself up 5000 feet up over a forest,0,0,2,0.05263157894736842,0.09090909090909091,78.60742950439453,92.3546142578125,0.021295804530382156,0.9669103026390076,0.7075584530830383,-0.011652350425720215,0.6862626485526562
neutral,entailment,A woman is walking her dog along a snowy ground.,A woman is trying to get her dog to go to the bathroom after it has freshly snowed.,-1,   There isa dog outside in the freshly snowed.,2,2,1,1.0,0.7368421052631579,101.00398254394531,46.451499938964844,0.0006927796057425439,0.9111225605010986,0.8691196441650391,-0.08743733167648315,0.8684268645592965
