Unnamed: 0,orig_premise,orig_hypothesis,gen_premise,gen_hypothesis,pred_orig_labels,pred_gen_premise_labels,pred_gen_hypothesis_labels,distance_premise,distance_hypothesis,perplexity_gen_hypothesis,perplexity_gen_premise,diff_premise_probs,diff_hypothesis_probs
157,a man biking down a tunnel.,a man is winning a bike race.,a man jogging in a tunnel.,[CLS] man is pulling a horse carriage.,2,0,0,0.2857142857142857,0.75,197.66720581054688,59.469154357910156,0.9937691711820662,0.9935535811819136
158,"a smiling man with gray hair and glasses, dressed in black, is sitting in a chair with a music stand in front of him.",this man has an eyesight deficiency.,"a fluorescent man with sharp hair and glasses, dressed in dread, is sitting on a chair with a fruit stand in front of him.",intact man has an expression and beak.,2,1,0,0.18518518518518517,0.5714285714285714,39.99985885620117,46.88591384887695,0.9082321785390377,0.6769098937511444
159,three children are shooting guns in the woods.,three children are shooting a deer.,three soldiers are hiding pigs in the woods.,three children are shooting a basket.,2,0,0,0.3333333333333333,0.14285714285714285,101.5510482788086,136.00460815429688,0.9961143909022212,0.9945247946307063
160,four people wearing backpacks walking in a line along a mountain trail.,four people are walking along a mountain trail trying to get down before the storm.,six people finishing commuters walking through the disturbance along a surfing trail.,ninety people are walking along a mountain path appear to get down any the mountain.,2,0,0,0.5384615384615384,0.3125,123.62445068359375,163.7187957763672,0.9958725142059848,0.9992289709625766
161,several people talk and drink beer while sitting around a picnic table.,several friends talk and drink beer while sitting around a picnic table.,college members talk and drink cheese while sitting around a dining table.,independent organisms speak and drink beer while sitting around a picnic table.,2,0,1,0.3076923076923077,0.23076923076923078,44.32786560058594,67.81889343261719,0.9952199672698043,0.8451467575505376
162,a smiling girl slides down a purple slide feet first.,a girl happily uses the equipment at a playground.,a elliott girl strips down a sunset playground stadium alone.,[CLS] girl remotely resembling the bandwidth at a playground.,1,0,1,0.5454545454545454,0.6,494.9764709472656,458.25146484375,0.6410119301290251,0.4252227544784546
163,a man in a purple and blue shirt and shorts is getting ready to hit a golf ball.,a man is on a golf course.,a man in a gray and blue shirt and shorts is getting ready to hit a breaking ball.,[CLS] man is on a dance board.,2,0,0,0.10526315789473684,0.625,53.54725646972656,32.62929916381836,0.9957627838011831,0.9976048057433218
164,a man is performing for a group in front of a white house.,the man performed in front of his own house.,a man condemned performing for a slave in front of a white house.,brute man performed in front of four green house.,2,0,0,0.14285714285714285,0.3,118.77769470214844,63.39185333251953,0.9172563180327415,0.9210177883505821
165,a young man is playing a blue guitar.,a musician practices on his guitar briefly before a concert.,"a young man, playing a trick ball.",[CLS] musician spit on his guitar unconscious before a concert.,2,0,0,0.3333333333333333,0.45454545454545453,184.2155303955078,110.9463119506836,0.9991471205139533,0.9987865124130622
166,two men help each other cut a sheet of plastic.,two friends help each other by cutting some plastic.,two cousins volunteers each other cut a pound of plastic.,these humans help each other with cutting the cloth.,2,1,1,0.2727272727272727,0.5,62.01031494140625,176.66273498535156,0.9260328933596611,0.9403051063418388
167,an old man in a blue shirt and white pants glowers by a glass door.,a man resting outside,the old man in a white jacket and white pants halters in a roadside driveway.,[CLS] man oxygen mechanically,2,1,0,0.4375,1.25,185.9638214111328,129.26025390625,0.4845491349697113,0.7046868875622749
168,"a little girl drawing with chalk, on a chalkboard.",a little girl is drawing on the board during class.,"a young girl grading with sixteen, on a chalkboard.",[CLS] little girl is burning on the floor during class.,2,1,0,0.2727272727272727,0.45454545454545453,89.0224609375,78.71736145019531,0.4698458220809698,0.9996488418255467
169,a wet golden retriever is walking through a lake,a wet golden retriever is walking through a lake to find a ball.,a ball sport retriever is sitting through a bat,"[CLS] clear "" retriever is seen through a lake. getting a splash.",2,0,1,0.4444444444444444,0.6428571428571429,232.54446411132812,125.87303161621094,0.9975383675191551,0.8872692826553248
170,a woman is sitting down doing some sort of craft work while another person operates a large wooden loom device in the background.,the woman sitting is asian.,"a hen is sitting down in some sort of montana, while the man notices a large reindeer loom flags in the background.",[CLS] woman sitting is destruction.,2,0,0,0.375,0.6666666666666666,138.1891326904297,111.242431640625,0.9570711904671043,0.9944697075989097
171,people in chairs around a table,the people are eating dinner.,are in dinner after a sixteenth,[CLS] people are offered seating.,2,1,1,0.6666666666666666,0.8333333333333334,304.98004150390625,287.94921875,0.9724580738693476,0.9840283486992121
172,a performer plays an instrument for the audience.,the performer is making music.,a performer plays the instrument for the audience.,[CLS] performer is providing music.,1,1,1,0.1111111111111111,0.6666666666666666,127.83470153808594,73.37181854248047,0.0009864568710327148,0.0031696557998657227
173,a group of people wait to cross the street in new york,some of the people are wearing sunglasses.,in typical of people fangs to cross the street in new york,many of the people are on mars.,2,0,0,0.25,0.375,94.6949462890625,156.02047729492188,0.7256270303623751,0.998111332883127
174,"two distinguished older gentlemen stand outside a house, trees in background, both with white hair, the taller man having his arm about the other man's shoulder as they face the camera from behind their corrective lenses.",the older men are colleagues.,"mature years seamen fellows stand outside the house, pale in white, covered with white hair, the outstretched man'his arm around the other man's shoulder. they face the camera from behind their corrective lenses.",molded deaf men are depicted.,2,1,0,0.34146341463414637,0.5,129.99517822265625,135.62904357910156,0.6220483597135171,0.9971787965041585
175,a young woman dressed in black attaches bags full of flowers to a bicycle.,the flowers are lilacs.,a young woman dressed in black chops bags full of sugar to a rainbow.,[CLS] flowers are galactic clouds.,2,0,0,0.2,1.0,171.74729919433594,179.4864501953125,0.9914125103969127,0.9983180065173656
176,"a man stands on a dock near several boats, while 2 other men are on one of the boats.",a man with brown hair is standing on a dock.,"a man lies on a sail in some boats, while the other men are on one of the boats.",a man with zombie hair is found on a dock.,2,0,0,0.23809523809523808,0.18181818181818182,45.81553268432617,33.33643341064453,0.9925274244160391,0.9990610471577384
177,a bird is perched on a line of some sort attached to a pole.,a bird is wallowing on a pole.,the bird is roared on a line of some sortvation to a pole.,[CLS] bird is comparatively miraculous on a pole.,2,0,1,0.26666666666666666,0.625,90.27168273925781,156.6280059814453,0.4850198468193412,0.9778604675084352
178,a person is on a four wheeler kicking up a lot of dirt in a dune.,the person is in a race.,a person is in a team chasing rounding up a lot of ground in a leisure.,[CLS] person is in a vehicle.,2,1,1,0.35294117647058826,0.5714285714285714,77.93733215332031,135.1580810546875,0.9041493677068502,0.9902414821553975
179,"a man wearing an oxford shirt, sunglasses, and a hat smirks.",a man hiding his true identity.,"a man wearing an equal shirt, hat, and a hat commendations.",[CLS] man retains his true likeness.,2,0,1,0.21428571428571427,0.7142857142857143,86.01261901855469,86.3320083618164,0.9674577116966248,0.9805909572169185
180,a group of people gathered at night watching an event.,a group of humans are looking at the same direction.,a group of people gathered at night watching an event.,[CLS] group of humans are looking at the same area.,1,1,1,0.0,0.36363636363636365,80.53047180175781,52.71364212036133,0.0,0.000779271125793457
181,a man in a suit cheering in a library in front of children.,a lawyer is encouraging some children at a contest.,a man in a dress naked in a circus in front of children.,[CLS] chance is holding some children at a bar.,2,0,0,0.21428571428571427,0.6,127.90007019042969,103.0660171508789,0.9807610642164946,0.97995818965137
182,security officer working outside.,a security officer is dressed in a uniform.,valet lashed stationed outside.,[CLS] security officer is available in a demeanor.,2,0,1,0.6,0.5555555555555556,336.2217712402344,632.0523681640625,0.6316487011790741,0.957952294498682
183,a man in a white and gray shirt looks on as a shirtless man with a mustache cleans fish on a pale green table.,the man is cleaning the fish that he caught so he can cook it.,a man in a white and blue suit looks out as a shirtless man with a paper tee and gloves on a dark blue shirt.,[CLS] man is eating the palm that he eats so he can bite it.,2,0,0,0.4,0.4666666666666667,67.39576721191406,49.71405792236328,0.9967275127128232,0.999002323980676
184,a young couple and many others out enjoying themselves at an outdoor street event.,the young couple are looking at goods being sold by the street vendors.,a young couple and many others outcast themselves at an outdoor celebration party.,[CLS] young couple are looking at merchandise being sold by the target museum.,2,0,0,0.26666666666666666,0.42857142857142855,151.5974578857422,85.94591522216797,0.9455332420766354,0.9428861401975155
185,construction workers use cables to hang from the sides of buildings.,construction workers are brave.,construction workers use slacks to argue on the sides of ministers.,[CLS] workers are free and,2,0,0,0.3333333333333333,1.0,130.755126953125,216.6358184814453,0.9157650545239449,0.955433614552021
186,a dark - haired man in a black uniform is speaking to a man wearing a black jacket and black helmet on a motorbike.,a man in a police uniform is talking to another man.,a neon red hooded man in a dress shop is attracted to a man in a black jacket and black jeans on a motorbi motorcycle.,elephant man in a refrigerator box is talking to another man.,2,0,0,0.4,0.25,56.02378845214844,41.289222717285156,0.984815594740212,0.985279199667275
187,a woman wearing a red coat stands on a wood floor in front of several paintings while two girls sit on the floor at her feet.,woman takes a break at a museum while her children sit by her feet.,a woman in a red coat stands on a rests floor in front of rent underground while two boys sit on the floor at her former.,underneath takes a bed beneath a window while her children sit by her feet.,2,1,0,0.2222222222222222,0.26666666666666666,54.08656311035156,93.67265319824219,0.8669958976097405,0.9940375467413105
188,a climber wearing a red headband is pulling himself up some gray rocks high above some green foliage.,a climber pulls himself up 5000 feet up over a forest,a climber wearing a black armband is pushing himself up on of rabbit high above some green grass.,a climber hangs himself up fifteen feet unmanned over a wall,0,0,0,0.3684210526315789,0.36363636363636365,145.3682861328125,85.26658630371094,0.018398523330688477,0.02083498239517212
189,a woman is walking her dog along a snowy ground.,a woman is trying to get her dog to go to the bathroom after it has freshly snowed.,the worker is running the dog through a haunted area.,[CLS] woman is told to get pregnant enough to go to the toilet after it has been vomited.,2,0,0,0.6363636363636364,0.47368421052631576,92.76184844970703,57.43004608154297,0.9890437008580193,0.999143767519854
190,a boy in a blue uniform is standing next to a boy in red and a boy in yellow and they are holding baseball gloves.,three boys are preparing for their big game that is about to start.,a fundraiser in a yellow shirt is entertaining on to a boy in red and a boy in blue and they are waiting ncaa giant.,barren farmers are famous for their fun game that is about to start.,2,1,0,0.34615384615384615,0.2857142857142857,53.16735076904297,98.0101089477539,0.9289864011807367,0.9985160834039561
191,"while two students are jumping, others in a classroom are sitting or standing.",two students disrupting class.,"while two freshmen are surged, those in a coach are attacked or standing.",eligible students cushioning a.,2,1,1,0.3333333333333333,0.8,274.31243896484375,899.5243530273438,0.862499781884253,0.8171160900965333
192,a man alone crosscountry skis in the wilderness while wearing a huge backpack.,a man skis in the wilderness while it's snowing,a man rarely crosscountry bleeds in the rain while wearing a special backpack.,[CLS] man glides in the wilderness while it's terrestrial behavior,2,0,1,0.2857142857142857,0.6,190.22084045410156,119.15379333496094,0.9991391350631602,0.9655422661453485
193,a well dressed elderly woman standing in front of a bus decorated with images of purple flowers.,a grandmother is standing in front of a bus with violets decorated all over it.,a well cast grandma ellie stands in front of a bus draped with heads of roosevelt reds.,[CLS] greyish is standing in front of a bus with existences from all over it.,2,1,0,0.4444444444444444,0.375,60.76762008666992,64.14601135253906,0.7840692326426506,0.9862480524461716
194,two girls kissing a man with a black shirt and brown hair on the cheeks.,two girls kiss there dad.,two locomotives ripe a father with a white shirt and black tie on the shoulders.,"autonomous girls, there are.",2,0,1,0.4375,0.5,159.5686798095703,215.16201782226562,0.9821009822189808,0.4793236255645752
195,a large man is sitting in front of a fountain statue while talking on a phone.,the fountain has running water.,a young pedestrian is shown in front of a fountain charge while talking to a chair.,[CLS] rooftop has inorganic water.,2,1,1,0.35294117647058826,0.8333333333333334,106.45848846435547,102.45973205566406,0.5632184147834778,0.31252044439315796
196,a man puts his hands up while telling an amusing story to his friend with a beard.,the man is perplexed by the events.,"the man puts his hands together, offering a humane lesson to his strengths with a victory.",[CLS] man is only dogged by the silence.,2,0,0,0.5,0.75,101.3695297241211,101.8846435546875,0.8931416273117065,0.9046521186828613
197,a man with a tattoo on his arm staring to the side with vehicles and buildings behind him.,a man has dragon tattoos on his arm.,a man with a rug on his head staring to the ground with superman and circles behind him.,a man has cellular colour on his arm.,2,0,1,0.2631578947368421,0.2222222222222222,70.26197052001953,77.81063079833984,0.9755638682981953,0.9962049144087359
198,"a man wearing dark knee boots, a green cape, and a hat with two big feathers on the front is sitting by himself on a bench in front of a building with a blue and white patterned piece of wheeled luggage to his right while he rests both his hands on a walking stick.",a man sits by himself at mardi gras.,"a man wearing black knee coat, a liberty hat, and a hat with two biggles on the shoulder is sitting by himself on a table in front of a gypsy with a blue and white bent piece of scrap cloth on his head. he holds both his hands on a live train.",a man stands by flicking at mardi maximas.,2,0,0,0.3157894736842105,0.3333333333333333,52.588741302490234,41.702613830566406,0.9450411088764668,0.957754660397768
199,a crowd of people in winter garb gather in the street against a backdrop of bare trees and snow.,it is cold and snowy outside.,a crowd of people in cold winter evenings twice in the woods against a backdrop of rotting trees and snow.,colour is spacious and light throughout.,1,1,0,0.25,0.5714285714285714,93.29843139648438,59.101993560791016,0.3202728033065796,0.9597269994555973
200,an asian man walks a three - wheeled pedal card fully of white bags.,an asian man walks a three - wheeled pedal card fully of white bags and he can be seen leaving the store.,an asian man shoot a three - wheeled tanaka card out of asian knives.,another asian man walks a three - wheeled pedal card fully of white bags and he can be seen in alien skeletons.,2,0,0,0.3333333333333333,0.17391304347826086,61.434226989746094,129.53883361816406,0.9889540318399668,0.9891443494707346
201,a couple about to kiss somewhere.,a couple are kissing on new years eve as the ball drops.,the first advises to get ken.,[CLS] couple is introduced on new years eve as the robot goddess.,2,0,0,0.7142857142857143,0.5384615384615384,309.3760681152344,297.57244873046875,0.9978213950525969,0.9900159880053252
202,a person in an orange shirt reaching up.,a person is reaching up to grab something.,the kid in an orange shirt squeezing up.,another person is normally able to touch something.,2,1,1,0.3333333333333333,0.4444444444444444,146.1604461669922,104.88330078125,0.8447222094982862,0.9714000206440687
203,a big dog catches a ball on his nose,a dog is playing with his owner,a gran dog enjoying a ball on his tail,[CLS] dog is one with his limbs,2,1,1,0.3333333333333333,0.7142857142857143,215.75369262695312,167.36822509765625,0.6525907753966749,0.992136740591377
204,an medical worker examines a young girl.,a health worker is evaluating a girl on her sickness.,an aids doctor attendants a young woman.,[CLS] health worker is alive a girl on her surface.,2,1,1,0.5,0.45454545454545453,259.0624694824219,315.3292236328125,0.9547282056882977,0.9880248503759503
205,there is a man poking a long stick up towards the ceiling.,the man has no arms.,there is a man pointing a long neck up to the ground.,[CLS] man has no arms.,0,0,0,0.3076923076923077,0.5,91.8705062866211,61.26963806152344,3.927946090698242e-05,-2.7418136596679688e-06
206,a man with two small boys making a purchase from a woman.,the man with the little boys is buying a gift from the woman's store.,the man with two small boys learning a mission from a woman.,[CLS] man with two little boys is approximately a product from the woman's body.,2,0,1,0.23076923076923078,0.4375,77.01923370361328,49.45722961425781,0.9941845927387476,0.8629599288105965
207,a woman standing in front of a large tank at an aquarium turns around to look at the photographer.,a woman wants a new facebook picture of her at the aquarium,a man named in front of a large spotlight at an ambulance dressed up to look out the new.,[CLS] woman managing a new unified glance of her at the aquarium,2,0,1,0.4,0.5,113.62494659423828,166.18710327148438,0.9988158388805459,0.9907174672698602
208,a woman standing in front of a wall holding a can of bud light with her shirt tied into a semi - halter.,the woman who is shown lives in the south.,a woman standing in front of a gypsy holding a cup of scandinavia cuisine with her hair tied to a jewel and halter.,[CLS] woman who is lying dead in the stomach.,2,0,0,0.3333333333333333,0.6,83.71652221679688,51.32642364501953,0.974817578215152,0.9940677327103913
209,a little boy with an orange backpack walks under a tree through the woods.,a boy walks to school through the woods.,"a little girl in an orange bus "" to a girl in the street.",@ boy walks toling through the woods.,2,0,1,0.5333333333333333,0.3333333333333333,139.69937133789062,79.27603149414062,0.9995940388180315,0.9803543747984804
210,a group of people are gathered on a sidewalk in front of a store nearby a littered street.,a group of people are considering whether to shop at the store.,a group of people are put on a dance in front of a fence on a terrorist street.,[CLS] group of people are shown machinery to appear at the store.,2,0,0,0.2631578947368421,0.46153846153846156,86.17888641357422,51.18349838256836,0.996076837531291,0.9963796291267499
211,"a man with a blue, collared shirt sits in front of another man.",a man is looking at his friend,"a man with a leather, pocketed shirt shares in his of buddy man.",[CLS] man is seen at his disposal,2,1,1,0.3333333333333333,0.7142857142857143,64.5659408569336,146.8758087158203,0.9301698952913284,0.9431762844324112
212,"four men in safety gear, one holding a camera, are standing on a platform.",there has been an accident,"two men in tragedy incurred, one holding a camera, one standing on a platform.",destruction has been unknown experience,2,1,0,0.23529411764705882,0.6,251.13650512695312,139.55068969726562,0.9482392519712448,0.9979862840264104
213,two men climbing on a wooden scaffold.,two sad men climbing on a wooden scaffold.,two men danced on a wooden scaffold.,six ordinary men climbing on a wooden scaffold.,2,0,0,0.125,0.2222222222222222,37.034461975097656,55.76236343383789,0.9980460312217474,0.9983610417693853
214,a group of children in costumes are on a stage with red curtains.,a group of children are performing a play,a number of children in opener are on a macbeth with red hair.,[CLS] group of children are physically a costumes,2,1,1,0.2857142857142857,0.625,199.47372436523438,109.57862854003906,0.953321493929252,0.9872226489242166
215,a red truck is parked next to a burning blue building while a man in a green vest runs toward it.,the burning blue building will turn to dust after an hour.,a red logo is parked next to a mickey blue building. a man in a yellow car runs through it.,[CLS] burning green building will turn to earth with an arrow.,2,0,0,0.2727272727272727,0.5833333333333334,78.530029296875,94.45201110839844,0.8689658641815186,0.8716670870780945
216,a man in a blue jogging suit is running on the sidewalk in front of a painting.,the man is sweating from his run.,a man in a white lung warlord isiated on the floor in front of a puzzle.,[CLS] man is differentiated from his body.,2,1,1,0.3888888888888889,0.625,79.06446838378906,144.106201171875,0.5455393362790346,0.9749311376363039
217,a band performing at a local bar or club.,the band is playing rock music,a modeling version at a local bar or club.,the band is playing music.,2,0,1,0.2,0.3333333333333333,50.8117561340332,157.526123046875,0.6673673767945729,0.9818554790108465
218,a group of people are sight seeing and taking pictures.,the group is on vacation,a number of people are officially returning and taking adventure.,[CLS] group is taken remotely,2,1,1,0.36363636363636365,1.0,225.64004516601562,159.93753051757812,0.8869985410710797,0.9971010753652081
219,"a little boy with a shirt, shorts and socks on, standing on the beach.",a boy is watching the ocean.,"a little boy with a shirt, shorts and socks on, singing on the chorus.",[CLS] boy is inside the car.,2,0,0,0.11764705882352941,0.7142857142857143,59.652339935302734,63.19278335571289,0.9992177059757523,0.9993518760311417
220,"five people standing on a stage, getting ready to perform, who are unrecognizable due to the lack of lighting.","at a rock concert, the audience screams and cries at the handsome singer and his bass guitarist.","the people participate in a theater, getting ready to dance, but are unrecognizable due to the lack of experience.","[CLS] a live concert, the audience screams and cheers at the famous singer and his backup guitarist.",0,0,0,0.3181818181818182,0.3684210526315789,55.321739196777344,49.04824447631836,0.00668865442276001,0.005573868751525879
221,a man with a cowboy hat and a gentleman with sunglasses on his head are seated next to each other.,the very differently dressed men sit next to each other,a man with a special hat and a groom with twinkle on his head are seated next to each other.,[CLS] here basic armoured men sit next to each other,0,0,1,0.14285714285714285,0.6,62.34560775756836,48.53221893310547,0.3232254981994629,0.7320750653743744
222,expert snowboard is trying a new trick.,the person is snowboarding on top of a mountain.,factory snowboard : irwin a new person.,[CLS] snow is snowboarding on top of a whale.,2,0,0,0.5,0.5,115.3471450805664,146.3696746826172,0.7593914270401001,0.9349192976951599
223,a woman lowering ballast on a boat.,the captain of the boat is preparing for rough waters.,a person still remains in a pool.,[CLS] trunk of the boat is searching for boiling waters.,2,0,0,0.625,0.5454545454545454,239.98126220703125,98.1167221069336,0.9632179588079453,0.9566939324140549
224,a small child is riding in a red wagon.,a kid is in a wagon and someone is pulling it.,a young host is rowing in a red kicker.,a human is in a dwelling and human is being it.,2,0,1,0.4,0.3333333333333333,93.8047866821289,117.566650390625,0.9820248166797683,0.9751415159553289
225,a group of people sitting around a table eating food.,people are at a table eating christmas dinner.,a group of people are at a table selling sex.,alone are at a table eating christmas eve.,2,0,0,0.36363636363636365,0.2222222222222222,66.12828063964844,73.86766815185547,0.9984069762867875,0.9988345204037614
226,"a person dressed in a dress with flowers and a stuffed bee attached to it, is pushing a baby stroller down the street.",an old lady pushing a stroller down a busy street.,"a worker dressed in a shirt with wings and a mini stick attached to it, is transporting a baby platter down the street.",an old pony rolls a stroller through a deserted street.,2,0,0,0.28,0.36363636363636365,44.59116744995117,52.181915283203125,0.6260049343109131,0.6262240409851074
