Unnamed: 0,orig_premise,orig_hypothesis,gen_premise,gen_hypothesis,pred_orig_labels,pred_gen_premise_labels,pred_gen_hypothesis_labels,distance_premise,distance_hypothesis,perplexity_gen_hypothesis,perplexity_gen_premise,diff_premise_probs,diff_hypothesis_probs
78,a woman is leaning down while talking to her phone.,a woman is using a phone,a woman is sitting down and listening to her reflection.,[CLS] woman is smoking a cigarette,1,0,0,0.36363636363636365,0.8333333333333334,83.65056610107422,51.8766975402832,0.7934195387642831,0.8708997953217477
79,a skier goes down a hill with a mountain as a backdrop.,a skier going down a hill.,a volcano goes up a hill with a mountain as a backdrop.,also skier training down the hill.,1,0,2,0.15384615384615385,0.42857142857142855,66.25054931640625,58.42906188964844,0.989393901953008,0.9754472160711884
80,"women of india performing with blue streamers, in beautiful blue costumes.",indian women perform together in gorgeous costumes,"women of india sculpture with blue streamers, in dark blue water.",##oese women perform best in gold costumes,1,0,0,0.23076923076923078,0.7142857142857143,442.001953125,219.0781707763672,0.5312248228001408,0.6838958022999577
81,a gymnast is seen defying gravity as she performs an impressive move several feet above the parallel bars.,a gymanst performing,a snow is shown defying convention as she performs an elaborate song several feet above the hotel bars.,[CLS] student danet moment,1,0,2,0.3157894736842105,2.0,211.35586547851562,544.8169555664062,0.9779148673405871,0.8394543901085854
82,players from two opposing teams wearing colorful cleats struggle to gain control over a ball on an astroturf field.,the players are playing a sport.,teams are two unionist teams with iron cleats modified to take control over a field on an icturf field.,[CLS] teams are playing a clock.,1,2,0,0.45,0.7142857142857143,120.04888916015625,163.81655883789062,0.5380623899400234,0.955169629160082
83,a young girl looking down through some leaves from atop a tree.,there is a girl outdoors.,a young man with down on a room. manning a room.,misty is a girl survivor.,1,0,2,0.6153846153846154,0.3333333333333333,139.56607055664062,131.6795196533203,0.9958290219801711,0.9880023275036365
84,a man holding a baby who is petting a pony.,a man with a baby is petting a pony.,a man like a devil who is petting a knife.,[CLS] man with a sheep is petting a pony.,1,0,0,0.2727272727272727,0.4,48.38733673095703,73.6604995727539,0.9980930075980723,0.9944310770370066
85,man in blue shirt yells and points off - camera while a man in a blue shirt and baseball cap watches.,a man is yelling.,sitting in blue jeans colorful and points to the camera while a man in a blue shirt and baseball caps watches.,[CLS] man in mr.,1,0,2,0.2727272727272727,1.0,105.13701629638672,74.82186889648438,0.9498281061532907,0.47312465077266097
86,a small child is riding in a red wagon.,a kid is in a wagon.,a small child is styled in a red dress.,her father is in a wild.,1,0,2,0.2,0.42857142857142855,89.5270767211914,99.95671844482422,0.9523379473830573,0.9556387327611446
87,a man in renaissance clothing is sitting on a brick wall.,the man is in costume,a man in cleaned fabric is sitting on a brick wall.,[CLS] man is in heaven,1,0,0,0.16666666666666666,0.8,166.7998504638672,114.17915344238281,0.9022974477848038,0.9971456633647904
88,a big black dog jumps in the air to catch the tennis ball in his mouth.,a dog is jumping.,a little black man looks in the air to see the cricket ball in his mouth.,[CLS] dog is eighteen.,1,0,2,0.29411764705882354,0.8,89.02861785888672,86.07059478759766,0.9969885538885137,0.9679049430415034
89,two men are boxing in fighting arena.,two men are boxing.,the men are participants in wrestling matches.,23 men are boxing.,1,0,0,0.5,0.2,340.3343200683594,206.7735137939453,0.9991259362432174,0.9972934510442428
90,a wall hung with multicolored crosses is visible behind the group of young men as they converse.,young men are talking,a window interspersed with multicolored windows is visible through the group of young men as they drive.,the men are single,1,2,2,0.2777777777777778,0.5,74.34481811523438,73.17786407470703,0.8810326028615236,0.9318874645978212
91,red - haired female answers questions while sitting at a table for craftzine.,she answers questions while sitting at a table.,red king < < prepare questions while sitting at a table for travel spot.,she rhymes repeatedly while sitting at a table.,1,0,0,0.42857142857142855,0.2222222222222222,136.74449157714844,191.16148376464844,0.9001606304082088,0.9887150723370723
92,"two men in costumes with fake carrot noses, top hats, sunglasses and white fur coats that contain white electrical lights.",people in costumes,"the men in nets with five visible hands, a hats, jeans and a fur coat that had white optic lights.",australia in costume,1,2,2,0.4782608695652174,0.6666666666666666,161.162353515625,264.99462890625,0.5443119648844004,0.9273033384233713
93,a man has wrecked his racing bike in the dirt with five spectators behind a rope.,a man has damaged something.,a photograph is marching his spare bike in the woods with two people on the mountain.,[CLS] man has killed millions.,1,2,0,0.5882352941176471,0.8333333333333334,265.9266357421875,229.4278106689453,0.9121934697031975,0.8823624143551569
94,a city street with market vendors and children being pushed in strollers with a large cathedral in the background.,the strollers are moving.,a beautiful street with adequate windows and banks being built in plasterers with a large garden in the background.,[CLS] rebuilding crisis is changing.,1,2,0,0.35,1.4,223.51673889160156,131.59848022460938,0.8127764984965324,0.9928726133075543
95,two men working on farm equipment that is being pulled by two horses.,the men are working on farm stuff.,the men working on telecommunication equipment that is being pulled by the horses.,[CLS] men are working on stealing eggs.,1,0,0,0.21428571428571427,0.625,106.9315414428711,99.25658416748047,0.9431628400488989,0.9834253007575171
96,woman running in a park while listening to music.,a woman jogging in a park.,others running in a park while listening to music.,[CLS] woman sleeps in a park.,1,2,0,0.1,0.5714285714285714,135.93348693847656,50.384830474853516,0.811977744102478,0.9961665130686015
97,a man in jeans and a brown shirt jumps high in the air in a living room that has a fireplace and wooden floor.,a guy in brown jumps up in a room with a wood floor,a bomb in jeans and a. grenade hove up in the air in a living room that has a burning and dirt floor.,[CLS] man in black dresses up in a room with a plastic floor,1,0,0,0.32,0.5384615384615384,40.48038864135742,87.07017517089844,0.9065603481431026,0.997336493601324
98,"the blond young man who had been splattered with paint colors of blue, orange, and green held up his camera to take a picture.",a man covered in paint takes a photo.,"the rooted young man who had been sperryed with hair balloons of blue, brown, and green gives up his cameras to take a picture.",[CLS] man'in blue pushed a tree.,1,2,0,0.25925925925925924,0.7777777777777778,88.80462646484375,93.5202407836914,0.893194293603301,0.9968885484850034
99,"one woman with jeans, gray shirt and sandals ; with girl in all pink watching a white ball float in midair.",the shirt is gray.,"a woman with shoes, wearing skirt and sandals, and men in all colours, a white shirt floating in midair.",the meat is black.,1,0,0,0.4782608695652174,0.4,163.79446411132812,70.2010498046875,0.9970589668082539,0.9660545379447285
100,3 people are shopping in a market.,there are people at a market.,"most, are usable in a small.",[CLS] are ten at a market.,1,2,0,0.5,0.5714285714285714,208.32948303222656,298.5400390625,0.5164358366746455,0.9795478111918783
101,a man is working in an art studio and is surrounded by art supplies.,a man is working on art.,a woman is working in an advertising studio and is surrounded by loud speakers.,[CLS] man is working on dreams.,1,0,2,0.26666666666666666,0.5714285714285714,71.62329864501953,50.47689437866211,0.999549362808466,0.6995841339230537
102,the man in black is flying off the full in front of a red fence.,the man is next to the fence.,the man in black is flying off the parade in front of a flaming banner.,[CLS] man is listening to the man.,1,0,0,0.1875,0.625,122.3989486694336,58.517276763916016,0.8872676938772202,0.7830569595098495
103,people are hiking up a mountain with no greenery.,the mountain is bare.,they are climbed up the mountain and theminary.,[CLS] mountain is sacred.,1,0,2,0.6,0.8,153.79568481445312,209.4200897216797,0.9923434732481837,0.6363177467137575
104,"an old man in a baseball hat and an old woman in a jean jacket are standing outside, but are covered mostly in shadow.",an old woman has a jean jacket.,"an old man in a sniper hat and an old woman in a headguard are standing outside, and are visible only in shadow.",[CLS] old woman has a leather jacket.,1,2,0,0.23076923076923078,0.5,48.38198471069336,48.715885162353516,0.9074418134987354,0.9857587752630934
105,a patient is being worked on by doctors and nurses.,someone is at the doctor.,a company is being worked on by nurses and nurses.,priest is also the doctor.,1,0,2,0.18181818181818182,0.3333333333333333,95.28336334228516,115.33394622802734,0.6043638726114295,0.8801091816276312
106,a young male wearing a white shirt with a character outlined very darkly.,a young male in a white shirt.,"a large woman without a white shirt, a photograph of and above.",a black male in a white jacket.,1,0,2,0.5714285714285714,0.25,62.73699188232422,77.06063842773438,0.9992318927543238,0.9872617954388261
107,a man wearing a white shirt and a blue jeans reading a newspaper while standing,a man is reading a newspaper.,"a scene wearing a red shirt and a blue jeans surrounded a man, standing",date man is reading a newspaper.,1,2,2,0.3333333333333333,0.14285714285714285,64.72447204589844,75.19053649902344,0.8106259303167462,0.9883347349241376
108,a man and woman setup a camera.,two people setup a device,a man and woman detection a child.,[CLS] people driving a motorcycle,1,0,0,0.25,1.0,270.6835021972656,299.3408508300781,0.8881972780800425,0.9988954415894113
109,two dogs run across the woods.,the canines run around in the forest.,two canine from across the bridge.,[CLS] crickets run around in the forest.,1,0,0,0.42857142857142855,0.5,99.885009765625,143.6992950439453,0.9959369773132494,0.9924223298294237
110,a man is kayaking in rough waters.,the man is in a boat,the man is snowboarding in polar waters.,[CLS] man is in a cabin,1,0,0,0.375,0.6666666666666666,157.26194763183594,63.640777587890625,0.9608952319249511,0.9932572161778808
111,"a person wearing a straw hat, standing outside working a steel apparatus with a pile of coconuts on the ground.",a person is near a pile of coconuts.,"a person wearing a straw hat, standing outside at a small door with a pile of straws on the ground.",deceased person is carrying a pile of coconuts.,1,0,0,0.18181818181818182,0.2222222222222222,45.56000900268555,36.07135772705078,0.9820112192828674,0.9073354804713745
112,several men at a bar watch a sports game on the television.,some men are watching tv at a bar.,the men in a neighborhood watch a football game on the streets.,[CLS] men are stalking ourselves for the bar.,1,0,2,0.38461538461538464,0.7777777777777778,153.1273651123047,76.3726577758789,0.9974787915125489,0.8000776991248131
113,a lit girl splashes around in natural water.,a girl splashes in water.,a human person splashes around in the water.,[CLS] shark splashes in water.,1,2,0,0.3333333333333333,0.6666666666666666,217.8887481689453,71.98112487792969,0.9804199924692512,0.9993641606415622
114,a boy is riding down the road between two cows.,"a boy, a road and two cows.",a sign is placed on the ground between two wings.,"[CLS] boy, a camel and two cows.",1,0,2,0.45454545454545453,0.4444444444444444,115.35919952392578,125.30012512207031,0.9973739599809051,0.9275254104286432
115,a group of attentive students are paying attention to a college lecture.,some students are attending a class.,a number of attentive people are paying attention to a red rug.,##2 students are attending a church.,1,2,0,0.3076923076923077,0.5714285714285714,113.53324890136719,99.24360656738281,0.8845061659812927,0.9988257848308422
116,a man laughing while at a restaurant.,a man laughing.,a man smelling while at a restaurant.,[CLS] man dying.,1,0,0,0.125,1.0,199.11830139160156,193.08172607421875,0.9980835681781173,0.9987686639651656
117,a woman wearing a yellow tank top and white pants looking into a window on a city street.,a woman wearing a tank top and pants looks through some glass.,a person wearing a red crop top and white pants looks shoot a block on a city street.,[CLS] woman wearing a tank top and pants looks through her pockets.,1,0,0,0.3157894736842105,0.38461538461538464,42.157745361328125,64.77796936035156,0.9901925153681077,0.9967710204073228
118,"a crowd of people in a stadium decked out in white, yellow and green cheer and clap for the team below.",a crwod is cheering,"a number of people in a stadium steeped up in white, yellow and green hedges and waiting for the team below.",[CLS] perfectly candid is now,1,2,0,0.21739130434782608,1.5,79.13568115234375,193.45513916015625,0.7476673386991024,0.9906619026878616
119,"two sweet young girls on ice skates, hands up and holding on to each other get ready to begin their performance on the ice.",two females holding each other.,"two very young passengers on ice skates, holding up and holding on to each other while ready to begin their life on the ice.",##s lies kissing each other.,1,2,0,0.19230769230769232,0.8333333333333334,93.7705307006836,46.616085052490234,0.9675681944936514,0.9974685007473454
120,a man in a short mohawk and beard.,a man with a short mohawk and beard stands outside.,a man in a bar dress and affection.,the man in a long mohawk and beard lives outside.,2,0,0,0.3333333333333333,0.36363636363636365,24.664840698242188,99.5230712890625,0.9947146102786064,0.977356307208538
121,a woman in a pink top is holding a glass bottle in one hand and a stitch doll in the other.,the top is pink,a man in a cage top hat holding a wine bottle in one hand and a jewel bottle in the other.,[CLS] top is tanned,1,0,2,0.2727272727272727,1.0,45.15625,36.106712341308594,0.50556640769355,0.9392525567673147
122,a girl in a black skirt and blue dress is watering flowers.,the girl is giving the flowers some water.,a girl in a white dress and red dress is eating candles.,@ cat is picking the flowers before them.,1,0,0,0.38461538461538464,0.5555555555555556,142.92742919921875,62.74342727661133,0.9926345124840736,0.9916958585381508
123,a pro - baseball pitcher sends a curve ball to his opponent while many fans relax and enjoy the game.,a pitcher is playing baseball at a stadium,a statue - trough pitcher sells a combat ball to his opponent. many are smiling and enjoy the game.,[CLS] pitcher is not baseball at a slam,1,2,0,0.3333333333333333,0.625,176.39927673339844,220.22389221191406,0.1776145100593567,0.9965031069586985
124,one confused man is standing and staring off into the distance in front of some ticket collecting machines.,the man is confused.,one masked man is standing and staring out into the distance in front of a mirror sales machines.,[CLS] man is dying.,1,2,0,0.2631578947368421,0.8,127.38077545166016,75.01395416259766,0.9908117209561169,0.6760825277451659
125,several men in black t - shirts and caps are using with metal rods to smash food that's lying on a round table with a hole in the center.,men using metal rods,"the men in black boots, cables and jackets are worn with matching rods to catch food that's located on a pool table with a hole in the center.",[CLS] using platinum bible,1,2,0,0.3225806451612903,1.25,140.7831573486328,115.56736755371094,0.9399830512702465,0.991236268193461
126,a group of people sitting and knitting.,people are sitting.,a group of people are and walking.,darts are required.,1,0,0,0.25,0.5,198.71421813964844,181.46688842773438,0.9965424546971917,0.9955604681745172
127,an older man sifts water through his fingers as a young toddler watches from inside the water.,a man is near a toddler,"an old man earned hails clouds through his body, a sign nutler watches from inside the home.",[CLS] man is killed a redwoodler,1,2,0,0.5,0.8333333333333334,240.3999786376953,457.21295166015625,0.6298054493963718,0.9963775798678398
128,"while traveling, a woman in a black jacket is resting on the shoulder of a man in a black jacket.",a woman rests on the shoulder of a man,"while dancing, a woman in a black jacket is hurled on the shoulder of a man with a black jacket.",[CLS] woman drown on the shoulder of a man,1,0,0,0.13636363636363635,0.4444444444444444,38.506072998046875,31.861072540283203,0.9828073866665363,0.9745299704372883
129,"a small, pale bird bends down to examine a crumb.",the bird is on the ground.,"a small, hooked bird leans down to middle a crestan.",[CLS] bird is on the flight.,2,0,0,0.3333333333333333,0.5714285714285714,124.39417266845703,241.07691955566406,0.602094829082489,0.7572234869003296
130,a man riding a motorcycle on a dirt road passing several junk or abandoned cars on the side of the road.,a man is riding a motorcyle.,a man driven a car on a busy road passes several abandoned or abandoned cars on the side of the road.,"[CLS] man, riding a dunlop motorcycle bicycle.",1,0,0,0.22727272727272727,1.0,65.35405731201172,29.912397384643555,0.997010386432521,0.9628095392836258
131,a skier is heading into a grove of trees.,there is snow on the ground in this picture.,the suit is etched into a pool of flowers.,there is mud underneath the ground in the moonlight.,1,0,2,0.5,0.4,65.97405242919922,63.01750946044922,0.9960608740802854,0.6292780339717865
132,two women bend over to touch a small kangaroo.,two women are petting a kangaroo,the men heads up to touch a large stream.,the women are gutting a kangaroo,2,0,0,0.6,0.3333333333333333,57.35265350341797,131.35003662109375,0.9973998032510281,0.776921983808279
133,a man with thinning hair looking into glasses through glasses.,a man with thinning hair.,a girl with thin new hair transitioned into venus in this.,[CLS] man with thin blue hair.,1,0,2,0.6363636363636364,0.8333333333333334,108.80933380126953,301.27459716796875,0.9984095658874139,0.9781500417739153
134,a kid dressed in a long - sleeve shirt with a jersey numbered 11 is passing a bar to a boy in a jersey numbered 12 during a relay race.,a team of youths race to finish first in a relay race on a beach.,a boy dressed in a long black plaid shirt with a matching numbered 11 is passing the bar to a boy in a jersey numbered 11 during a relay race.,[CLS] group of students race to finish first in a relay race on the beach.,2,2,2,0.1935483870967742,0.375,74.0353775024414,58.09402084350586,-0.0009091496467590332,-0.006426751613616943
135,a man is riding a bicycle in the street.,a bicycle is being ridden,a photograph is just a bicycle in the house.,a woman is being chased,1,0,0,0.3,0.4,26.063627243041992,77.52391052246094,0.836321545066312,0.9979487780947238
136,a woman with a pink purse walks down a crowded sidewalk.,a woman walks through a crowd,a man with a pink dress sits on a green sidewalk.,[CLS] woman walks through a flat,1,0,0,0.4166666666666667,0.6666666666666666,118.1995849609375,47.60712814331055,0.998881028033793,0.998525426723063
137,"a large number of people are watching men dressed in kilts, one of whom has thrown a long pole.",people watch men in kilts,"a large number of animals are useful, dressed in camouflagelts, one of whom has been a dress pole.",guerrillas watch men in kilts,1,0,2,0.2857142857142857,0.2,59.440948486328125,228.24813842773438,0.9967486345267389,0.991067080758512
138,"two babies, one in red, asleep in their highchairs.",babies are asleep,"two guards, one in each, glow in their high shiners.",[CLS] are pink,1,0,0,0.4166666666666667,1.3333333333333333,182.17669677734375,310.7873840332031,0.9984889670158736,0.9724298759247176
139,some folks pick out the food they want at a party.,the party - goers are perusing the buffet.,some friends give them the tasks they want at a party.,[CLS] party - goers are hauntedsing the bible.,2,2,2,0.3333333333333333,0.5555555555555556,398.1346435546875,136.32034301757812,0.4025222659111023,0.15276849269866943
140,a small dog runs to catch a ball.,a little dog chases a ball.,a little person born to throw a ball.,[CLS] small dog whispering a ball.,1,0,0,0.4444444444444444,0.7142857142857143,172.0679931640625,58.89412307739258,0.9884887533844449,0.9811595874489285
141,a white and black spotted dog is running through a grassy area.,a dog is outdoors.,a white and cream chin dog is styled with a triangle area.,a dog is hunting.,1,2,2,0.38461538461538464,0.2,76.4014663696289,339.6907958984375,0.9040813706815243,0.9595976732671261
142,the black woman is laying out literature.,a black woman is handling printed material.,the black emperor is inside out poison.,[CLS] black woman is collecting lesbian material.,1,0,2,0.375,0.625,249.98666381835938,779.3629150390625,0.98477462939627,0.9929638807661831
143,island native fishermen reeling in their nets after a long day's work.,the men are finishing their day of work.,"the shuttle weaving slowly in the bushes with a long day's work,",[CLS] children are veterans their day of birth.,1,2,0,0.5714285714285714,0.6666666666666666,277.3747863769531,84.7313003540039,0.8273316994309425,0.7936492101289332
144,a dog jumps over the pole.,dog is jumping over a pole,a scene occurs over the end.,marines is jumping over a pole,1,2,0,0.42857142857142855,0.16666666666666666,164.3440399169922,389.784423828125,0.4714914970099926,0.9720452288747765
145,a man running in a race passes by spectators.,a man is running by people who are watching.,a man running in a car passes by trees.,[CLS] man is caught by people who are kneeling.,1,2,0,0.2,0.5,166.0552215576172,71.05074310302734,0.9811354614794254,0.994445979129523
146,a man talks to two guards as he holds a drink.,the prisoner is talking to two guards in the prison cafeteria.,a man oblivious to two snakes who he holds a gun.,the beast is talking to the guards in the prison maze.,2,0,0,0.3333333333333333,0.25,67.7353744506836,131.45448303222656,0.9784416407346725,0.9782195538282394
147,a woman with a black purse and a red coat is sitting on a pillar of concrete.,the woman is waiting for her boyfriend at the local bus stop.,a girl with a red dress and a red roof is sitting on a stack of fire.,[CLS] woman is fighting for her boyfriend in the open machine room.,2,0,0,0.3333333333333333,0.6153846153846154,80.45086669921875,35.702171325683594,0.9925984600558877,0.9977832892909646
148,"one man wearing a pink and blue striped shirt, work gloves, and holding a yellow hard hat.",a tall person in a shirt,"one man wearing a pink and white striped shirt, denim parody, and holding a black mini hat.",a cleaned person in a room,2,2,0,0.25,0.3333333333333333,80.402587890625,83.63353729248047,-0.001841902732849121,0.9903944337274879
149,a barber in a sports themed barber shop waits for his next customer to arrive.,a barber in a sports shop waits eagerly for business.,a barber in a french themed barber shop waits for his work ready to visit.,[CLS] sailor in a sports car waits anxiously for business.,2,0,0,0.25,0.5454545454545454,77.8355712890625,87.30364990234375,0.9614194594323635,0.9927009306848049
150,"boy in backpack crossing the street, other people, all asian, are all in crosswalk walking towards the boy.",the boy is on his way home from school.,"boy in action into the crowd, other people, and warriors, are all in bar brawls towards the boy.",[CLS] boy is on his yacht home in school.,2,0,0,0.3181818181818182,0.5,187.69334411621094,67.5418930053711,0.9865354211069643,0.9985404522158206
151,the cyclist rides on a wooded path.,the cyclist rides with a companion on a wooded path,the gang rides on a wooded path.,[CLS] cyclist rides with a vehicle on a wheeled surface,2,0,1,0.125,0.6,100.4094009399414,63.27471160888672,0.9047883996972814,0.9747201278805733
152,a woman working in the storefront of a jewelry shop fixing the display shelf.,the woman is dreaming of a modeling career while working in the jewelry shop.,a woman working in the backroom of a printing shop serves the mail service.,[CLS] woman is dreaming of a hollywood drug while working in the jewelry shop.,2,0,0,0.3333333333333333,0.3333333333333333,98.63816833496094,64.74906921386719,0.574063628911972,0.5702140033245087
153,two people play horseshoes.,tom and sue were playing outside.,twosome play ashores.,pete and mike are playing chess.,2,1,0,0.6,0.5714285714285714,83.71328735351562,900.9056396484375,0.5152227431535721,0.9940625540912151
154,two adult men in black t - shirt and loud tunics hold smoking torches in preparation for an act of entertainment or celebration in a forested environment.,two brothers hold torches to celebrate.,two fathers twin in black leather dress shirt and white tunics wear dance candles in preparation for their act of entertainment and celebration in a religious environment.,##ural mortals hold torches to display.,2,1,0,0.39285714285714285,0.7142857142857143,291.3880615234375,164.4327850341797,0.8239376473939046,0.9409741118433885
155,several adults look on while a young girl plays in a ball pit.,a young girl is having fun.,the scarcely thrive on while a young girl like in a ball game.,[CLS] young girl is available sport.,2,1,1,0.35714285714285715,0.7142857142857143,126.67530059814453,178.48353576660156,0.7146033346652985,0.7916872203350067
156,a girl climbing a chain link fence.,the girl climbs the fence to get to school.,a girl broke a chain link fence.,[CLS] girl climbs the wall to her to infinity.,2,0,0,0.125,0.6,149.3944854736328,49.270240783691406,0.9974952158518136,0.9912301716394722
