Unnamed: 0,orig_premise,orig_hypothesis,gen_premise,gen_hypothesis,pred_orig_labels,pred_gen_premise_labels,pred_gen_hypothesis_labels,distance_premise,distance_hypothesis,perplexity_gen_hypothesis,perplexity_gen_premise,diff_premise_probs,diff_hypothesis_probs
0,a man with a beard is talking on the cellphone and standing next to someone who is lying down on the street.,a man is prone on the street while another man stands next to him.,a man with a hat is relaxing on a cellphone and walks next to someone who is gazing down on the street.,[CLS] man is lying against the floor of another man kneeling next to him.,1,0,0,0.21739130434782608,0.5333333333333333,37.80463790893555,40.56631088256836,0.9869836373254657,0.9739064378663898
1,a kid slides down a yellow slide into a swimming pool.,the child slides into the pool.,a foreman drinks down a man slide into a swimming pool.,the four change into the pool.,1,0,0,0.25,0.2857142857142857,91.55279541015625,81.45755767822266,0.9941540189902298,0.9949418135802262
2,a woman talks on a cellphone while sitting in front of blue railings that are in front of the ocean.,she has a conversation on her phone outdoors,a woman comes in a rowanphone while sitting in front of two liness that are in front of the throat.,she has a bear on her phone after,1,2,0,0.2857142857142857,0.25,51.54115676879883,142.83810424804688,0.9407796151936054,0.9490240519953659
3,"a lady, dressed in a costume, is posing with an axe in the middle of the woods.",a lady with an axe is posing in the middle of the woods.,"a masked, dressed in a costume, is seen with an expanse in the middle of the woods.",a knight with an eagle is shown in the middle of the woods.,1,2,0,0.15,0.21428571428571427,22.313596725463867,27.698923110961914,0.8359339162707329,0.9967172987526283
4,a man in a boom lift bucket welds.,a man is working.,a man in a midtown coat frame marlborough smokes.,[CLS] man is unemployed.,1,2,0,0.5555555555555556,0.8,473.92059326171875,281.56939697265625,0.6485280394554138,0.9901032827328891
5,"runners in various athletic garb, as well as one individual in a spotted - green dragon costume, run to the right.",runners see a dragon costumed person,"dogs in appropriate athletic garb, as well as one chapter in a japan in green dragon book, ride to the right.",macdonald ride a dragon costume in plush,1,0,0,0.2916666666666667,0.8333333333333334,246.4342803955078,298.07989501953125,0.5898193717002869,0.6649903655052185
6,"rider in ceremonial garb rides white arabian horse, also wearing ceremonial blankets and tassels.",the rider and horse are covered in gear.,"depicted in simplest garb ʔ statue vases, and wearing black curls and tassels.",[CLS] rider and bicycles are covered in baskets.,1,0,0,0.5625,0.5555555555555556,205.16781616210938,283.6061096191406,0.9846988591598347,0.9995246204780415
7,"two uniformed women, wearing jackets saying "" politie "" on the back, are looking at each other in front of a crowd.",the women are wearing clothes,"two shave women, a stone inscribed "" tipitie "" on the back, are positioned at each other in front of a table.",[CLS] women are wearing pajamas,1,2,0,0.28,0.8,58.90111541748047,104.40252685546875,0.7608653288334608,0.9990959253627807
8,a young man standing outside a laundromat.,a man is standing.,"a special man, at a laundromat.",[CLS] man is thrown up,1,2,0,0.375,1.0,84.76884460449219,98.96526336669922,0.5812386469915509,0.9985831054946175
9,two people bicycle on a path separated by small mountains.,two people are riding on bikes outside.,two spheres stands on a wall separated by several hills.,winning people are riding on them together.,1,0,2,0.45454545454545453,0.375,172.5142364501953,152.52609252929688,0.9992482635716442,0.9299518801271915
10,bubbles surround a statue in the middle of a street.,there are bubbles around the statue.,it is a statue in the middle of the park.,missiles are positioned around the statue.,1,2,0,0.36363636363636365,0.2857142857142857,68.85948944091797,31.211000442504883,0.9253943338990211,0.9990954932291061
11,a young boy hanging on a pole smiling at the camera.,the young boy is smiling.,a young boy tattooed on a wall pointing at the camera.,the young boy is interviewed.,1,2,2,0.25,0.16666666666666666,61.314064025878906,38.10004425048828,0.9770874343812466,0.5413150154054165
12,a man sits on a couch beside a colorful cushion with a pencil in his hand.,the man is holding a pencil.,a man sits on a couch beside a white couch with a bag in his hand.,[CLS] man is holding a cigarette.,1,0,0,0.17647058823529413,0.5714285714285714,48.761077880859375,20.815277099609375,0.714359609701205,0.9774695917149074
13,"three men in yellow green safety vests sit on a bench yawning, smoking and having a break.",there are people seated.,"three men in a green jacket shines them on a wall sewning, charging and having a gun.",victims are gang heads.,1,0,2,0.42105263157894735,0.6,165.4010467529297,277.84747314453125,0.9938730517751537,0.9003543970175087
14,"a man in gray on a rocky cliff, overlooking the mountains.",a man can see mountains from where he stands.,"a light in blue on a green swirl, in the attic.",a man can see it from where he dies.,1,0,2,0.46153846153846156,0.2,80.12308502197266,112.83084106445312,0.9985188491700683,0.74643225222826
15,a hockey player in blue and red guarding the goal.,a person playing a sport,a taft player in mel and red represent the character.,[CLS] blue playing a restricted,1,2,2,0.36363636363636365,1.0,259.26019287109375,519.9525146484375,0.39245492964982986,0.6716775670647621
16,people standing in front of a gray building with a sign that reads'tickets available here '.,the people are standing outside.,people sit in front of a red sofa with a sign that reads'soul lies here '.,[CLS] people are eating outside.,1,0,0,0.29411764705882354,0.6666666666666666,204.23779296875,134.57119750976562,0.9985204157419503,0.7371415314264596
17,a solo shot of a man riding a four wheeler in an atv event.,the man is entered in a event.,a video shot of a man riding a white horse in an avalanche landscape.,[CLS] two is set in a dream.,1,2,0,0.3333333333333333,0.75,135.4821319580078,100.17916870117188,0.8516288548707962,0.9260172275826335
18,a skier ski - jumping while two other skiers watch his act.,a skier preparing a trick,a psychiatrist achievement in riding while two other skiers watch his act.,[CLS] skier folding a chair,2,0,0,0.3076923076923077,1.0,263.9073791503906,551.4283447265625,0.8159676566720009,0.9549057260155678
19,large brown dog walking in shallow water.,a brown dog is walking outside,a hot dog inside in boiling water.,[CLS] brown dog is classified first,1,0,2,0.5,0.8333333333333334,440.83648681640625,183.5300750732422,0.9910623487085104,0.7672010064125061
20,a man in a black shirt and brown pants is jumping in the air performing a karate kick towards a man in a red shirt and black hat.,two males are involved in martial arts.,"a sport in a red shirt and white pants, fly in the air performing a fly sax or a woman in a red shirt and black tie.",[CLS] students are involved in rebellious dancing.,1,0,0,0.3448275862068966,0.75,52.25282669067383,79.15481567382812,0.9676121545198839,0.9904000831011217
21,a guy in glasses is biting into a pink marshmallow chick while somebody else is puckering their lips out wanting a bite.,a man is eating a marshmallow.,a scene in films is kicking into a young marshmallow car while someone else is stretchering their way out using a car.,[CLS] man is cooking a brookmallow.,1,0,0,0.43478260869565216,0.7142857142857143,218.07615661621094,111.4781494140625,0.9427690953016281,0.9467760771512985
22,a man wearing a red vest is walking past a black and green fence.,a man is wearing a vest.,a group wearing a red hat is walking past a blue and white fence.,[CLS] black is wearing a sunglasses.,1,0,2,0.26666666666666666,0.7142857142857143,99.79203033447266,56.56102752685547,0.9425584613636602,0.9260397301986814
23,a young girl with water wings leaps into a crowded pool,there are people in a pool.,a beautiful girl with balloon wings transforms into a outdoor air,they are standing in a maze.,1,0,0,0.45454545454545453,0.42857142857142855,116.94168853759766,267.49920654296875,0.9213893626874778,0.9993059252446983
24,a man sitting on steps with a child as a bystander walks by.,a man and a child sitting on steps saw a bystander.,a gig sitting on ten with a sights as a bystander walks by.,[CLS] man and a child sitting on steps chases a bystander.,1,0,0,0.21428571428571427,0.3333333333333333,47.4085693359375,247.515625,0.8272622246295214,0.983984412625432
25,the girl wearing a brown jacket whilst walking in snow.,the girl is walking outside.,the girl becomes a purple dress while dressed in makeup.,[CLS] girl is crying..,1,0,0,0.5454545454545454,1.0,214.2802734375,128.03358459472656,0.8743411437026225,0.8808525339118205
26,a young woman wearing a yellow shirt and off - white shorts is reading a book while sitting on a park bench.,a woman reading a book while sitting on a bench.,a white man wearing a red shirt and black a white shorts is wearing a book while sitting on a park bench.,[CLS] woman licking a book while sitting on a bench.,1,0,0,0.2608695652173913,0.36363636363636365,47.628028869628906,26.207529067993164,0.9971106075099669,0.9972330950549804
27,"an asian woman in a purple shirt preparing a bowl of food for the younger asian boy sitting near buy, while an asian man eats a roll and prepares to take some food up with his chopsticks.",a woman is preparing food for a child.,"an asian man in a white shirt provides a lot of food for the other asian traders sitting on stool, while an asian man eats a lot and seems to take some food off with his chopsticks.",[CLS] chinese is preparing food for a funeral.,1,0,2,0.28205128205128205,0.5555555555555556,77.5336685180664,43.86640167236328,0.9990135508123785,0.6864617732353508
28,a woman and child are on a boat and the woman is looking out into the ocean through a scope.,a lady is looking through a scope at the ocean.,a portrait and man are in a boat and the family is looking out into the future through a portal.,[CLS] smiley is looking through a hole in the ocean.,1,0,2,0.2857142857142857,0.5454545454545454,52.22583770751953,62.12440490722656,0.9880887395702302,0.6133110374212265
29,an indian woman stands in an outdoor marketplace.,a female is outdoors at a bazaar.,an added view appears in an outdoor commercial.,a woman is dancing at a picnic.,1,2,0,0.4444444444444444,0.375,92.549072265625,372.55596923828125,0.9727102257311344,0.9993344264512416
30,two teen boys in school clothes are walking with something in a garbage bag.,two boys are walking together carrying a bag.,two adolescent boys in school who are hidden in handcuffs in a garbage bag.,the boys are eating together sharing the bag.,1,0,0,0.3333333333333333,0.4444444444444444,91.28591918945312,74.3351058959961,0.9562690218444914,0.8573757966514677
31,"two children, both wearing tan coats, are embracing one another.",two kids are hugging.,"two pairs, both wearing red suits, are eating one another.",[CLS] children are classmates.,1,0,2,0.3076923076923077,1.0,140.17178344726562,127.26834106445312,0.9992873936280375,0.9786816788837314
32,a group of consumers walking through a public market to purchase vegetables with the background of the busy store just behind them.,shoppers purchasing vegetables at a busy public market.,a group of queens walking in a public park to pick vegetables with the edge of the field green just behind them.,gallopers feed them at a very public market.,1,0,0,0.30434782608695654,0.4444444444444444,139.6982421875,112.16352844238281,0.8999320876318961,0.9662227642256767
33,several street vehicles pass by a traditional architecture style of thailand.,vehicles are going down a street in thailand.,several street trams pass by a modernist architecture style of art.,launches are going down the street in 2014.,1,2,2,0.25,0.3333333333333333,272.2383728027344,132.52549743652344,0.9209441542625427,0.9120575785636902
34,a man wearing a shite short - sleeved shirt kisses a woman wearing a light pink jacket while standing on a public street.,a man is kissing a woman,a man wearing a messe white silk sleeved shirt portrays a man wearing a hot pink shirt while standing on a public square.,[CLS] man is dating a woman,1,0,2,0.3333333333333333,0.6666666666666666,77.45049285888672,70.87012481689453,0.9991041071771178,0.9848681660369039
35,a young woman is wearing a paper crown at an outdoor event.,the woman is outdoors,a young woman is wearing a slit crown at an inappropriate event.,[CLS] woman is terrified,1,2,0,0.15384615384615385,1.0,154.74720764160156,168.716064453125,0.8970197029411793,0.5124399298802018
36,two women look at a table with assorted items on it in some sort of market that others are currently browsing.,two women are looking,two children sit at a table with assorted items on it in some sort of space that others are supposed seeing.,[CLS] women are beautiful,1,0,2,0.22727272727272727,1.0,105.33341979980469,90.08755493164062,0.9813589414115995,0.963353481143713
37,a fat woman wearing faint blue top is blowing soap bubble.,a fat woman is wearing a shirt.,a beautiful woman whose pale blue body is underneath soap bubbles.,[CLS] fat woman is wearing a mask.,2,2,0,0.5,0.5,252.56187438964844,157.80429077148438,0.14424455165863037,0.9101732447743416
38,a man in a suit driving a horse - drawn buggy down a stone street.,the man is driving a buggy.,a man in a suit holds a horse and a bun. in a city street.,[CLS] man is killing a metrogy.,1,0,0,0.4375,0.7142857142857143,322.8281555175781,46.609474182128906,0.9983439367206302,0.9510497372539248
39,expert snowboard is trying a new trick.,the person is snowboarding.,this black music is creating a new genre.,the robot is snowboarding.,1,0,0,0.625,0.2,127.25200653076172,193.2475128173828,0.9989826361997984,0.9980881492956541
40,an asian lady is holding a cup and sitting in front of a table covered in different foods.,there is a table next to a lady.,an intact chef is holding a meal and is in front of a table covered with hard liquids.,dungeon is a bedroom next to the lady.,1,0,0,0.3684210526315789,0.3333333333333333,92.18523406982422,83.1280746459961,0.8819554086076096,0.9984309311257675
41,an asian young woman wearing a white shirt and black pants is holding a pink purse.,the woman is holding a purse.,an attractive young man wearing a white shirt and black pants is wearing a black sweater.,[CLS] two is holding a tie.,1,0,0,0.29411764705882354,0.7142857142857143,65.84459686279297,25.66313362121582,0.9840731955773663,0.9884729720361065
42,a woman wearing a red hat and red bandanna followed by a man in a red bandanna.,the people are wearing bandanas.,a statue has a red bra and red goanna surrounded by a man in a red goanna.,[CLS] women are eating pork eggs.,1,0,0,0.3333333333333333,1.1666666666666667,56.05914306640625,76.34414672851562,0.6185975046828389,0.9825924606993794
43,a white man taking a photo in front of water.,a man is in front of water.,a white man has a studio in front of darkness.,savage man is in front of water.,1,0,0,0.2727272727272727,0.125,57.67255401611328,87.05443572998047,0.9910020240349695,0.8669918783707544
44,a man in a blue jacket holding a handsaw sawing a pipe on top of a wood fence.,someone is sawing.,a man in a leather jacket holding a red and anchoring a bible on top of a wooden fence.,##virus is spiraling.,1,0,0,0.3157894736842105,1.0,94.56639099121094,86.42955017089844,0.9392237121937796,0.9959319884655997
45,a man touching a hanging strand of lamps.,a man is reaching out to a strand of lamps.,a man with a single strand of shadows.,[CLS] man is chased out of a pile of corpses.,1,2,0,0.3333333333333333,0.6363636363636364,225.3871307373047,103.0186538696289,0.5231269896030426,0.999563361343462
46,dog running with a purple toy in the snowy field.,a dog is running.,horseback running with a white cat in a snowy field.,[CLS] dog is radioactive.,1,0,0,0.36363636363636365,0.8,302.0709533691406,120.14188385009766,0.9979344705789117,0.9980270961968927
47,two bearded men sit side by side.,two men are sitting down.,two bodies men guards side by side.,murdered men are sitting down.,1,0,2,0.25,0.16666666666666666,147.21775817871094,199.78211975097656,0.9969733737816568,0.7247113604098558
48,two men in karate gear using fighting sticks.,two karate men sparring with sticks,two men in riot gear with cloth under.,youngest indian men sparring with their,1,0,2,0.4444444444444444,0.5,254.1278533935547,255.8566131591797,0.9960643926169723,0.835246279835701
49,man and woman rowing on surfboards third rower in distance.,couples rowing on surfboards.,men and woman rowing on weatherboards for rower in 2012.,mutant hiking on surfboards.,2,0,0,0.36363636363636365,0.4,351.24420166015625,145.2745361328125,0.8022205550223589,0.9736008960753679
50,a person sweeping stairs in a park.,a person outside.,a person inside chairs in a room.,[CLS] short outside.,1,0,2,0.375,1.0,377.5024719238281,128.66677856445312,0.9984820437384769,0.8724378263577819
51,"four young men stare up at a basketball hoop with no net, in an outdoor, urban basketball court.",four young men looking up at a basketball hoop.,"two young women blow up at a basketball hoop with no net, in an outdoor, outdoor basketball court.",[CLS] young men crying up at the basketball hoop.,1,0,0,0.19047619047619047,0.5,104.28530883789062,64.55553436279297,0.9984574094414711,0.856906034052372
52,a solo cyclist is riding down a windy road.,a cyclist rides down a road,a little passengers is walking down a busy road.,[CLS] solo flying off the road,1,0,0,0.4,1.1666666666666667,184.6338653564453,120.16297149658203,0.9986669764621183,0.9912522778613493
53,a person standing next to an old dark building.,a person standing near a building.,a tree sits next to an old log and.,[CLS] person standing underneath the building.,1,0,0,0.4,0.7142857142857143,88.51453399658203,104.10466003417969,0.9878467520611593,0.9229923685925314
54,"two hockey players on opposing teams, one in a red and white jersey and one in a blue and black jersey, are standing on the rink.",hockey players are standing on the ice rink.,"two polo players on opposing teams, one in a red and white jersey and one in a blue and black jersey, are standing on the jersey.",hockey players are standing on the stockholm rink.,1,0,2,0.06896551724137931,0.1111111111111111,21.84109878540039,27.99591827392578,0.9989779051975347,0.8425323069095612
55,a man is playing with his skateboard on a street.,a man is outside.,a girl is now with a fingerboard on a one.,[CLS] man is driving.,1,0,0,0.45454545454545453,0.8,83.02440643310547,151.0467071533203,0.996574289893033,0.9987705422390718
56,"a guy on rollerblades, sliding across a rail.",the skateboarder rides the rail.,a cameo on rollerblazers is running over a desert.,[CLS] skateboarder rides the train.,0,0,0,0.6,0.6666666666666666,111.52120971679688,184.60104370117188,0.0024352073669433594,0.001262366771697998
57,the man white purple and white polka - dotted shirts is eating and looking to his right while the woman behind him has a confused look on her face.,a person is consuming food.,the man wearing black and white striped and striped shirts is brighter and looking to the right and the man behind him has a distant look on her face.,[CLS] black is mimic flowers.,1,0,0,0.3333333333333333,1.0,158.0428466796875,64.44271850585938,0.9699761036390555,0.9970905545706046
58,a woman is in the middle of hitting a tennis ball.,a woman is playing tennis.,a woman is in the middle of purchasing a swimming ball.,[CLS] woman is playing monopoly.,1,0,0,0.16666666666666666,0.6666666666666666,119.8393783569336,51.01774215698242,0.9982259031385183,0.9981329794973135
59,there are two people walking in the sand.,two people walk across the beach.,there are two people walking in the rain.,[CLS] people walk across the estate.,2,0,0,0.1111111111111111,0.5714285714285714,98.30634307861328,35.487396240234375,0.9660127945244312,0.9481816478073597
60,a man sitting and a woman laying in his lap kissing each other.,a man sitting and woman laying in his lap.,a man sitting and a woman doing in a wallenary each other.,[CLS] man sitting and talking silently in his lap.,1,0,0,0.2857142857142857,0.5,64.42093658447266,125.40185546875,0.9910389306023717,0.9900282146409154
61,an elderly woman with a tan nun uniform on and glasses is taking a picture with her camera.,a woman is in a tan nun uniform.,an elderly woman with a tan chew bottle on his shoulder is wearing a picture with her hands.,[CLS] woman is in a tan nun shower.,1,0,0,0.3157894736842105,0.4444444444444444,121.1457290649414,146.58969116210938,0.5653684443095699,0.9910706585505977
62,four women standing around a yellow table are looking at laptops.,a group of women looking at laptops together.,two images inscribed on a human table are found at æs.,[CLS] group of women looking at laptops fly.,1,0,0,0.5833333333333334,0.4444444444444444,161.9658660888672,212.54014587402344,0.9984709873097017,0.9927732601063326
63,artist on street corner selling his artwork.,someone is selling paintings.,exhibition on street and sells his works.,[CLS] is selling shirts.,2,2,0,0.5,0.8,275.143798828125,385.4286804199219,0.008811116218566895,0.658074694336392
64,a boy dressed for summer in a green shirt and kahki shorts extends food to a reindeer in a petting zoo.,a boy alien dressed for summer in a green shirt and kahki shorts,a boy dressed for an in a green shirt and kabuki shorts ended next to a bird in a bunting zoo.,[CLS] boy alien dressed for summer in a green shirt and kahki shorts,0,0,0,0.2727272727272727,0.23076923076923078,48.68465042114258,101.94782257080078,-0.001571059226989746,4.3392181396484375e-05
65,a man in a brown shirt and blue shorts walking in droney park.,a man walking in droney park.,a man in a white shirt and blue suit riding in coney park.,[CLS] man running in droney park.,1,0,0,0.2857142857142857,0.5714285714285714,87.8342514038086,115.0761489868164,0.9962061119149439,0.8341814351151697
66,a young man blew up balloons to craft into animals for the seven excited children that looked on.,the children are watching the man blow up balloons,the young man cleaning up posters to organize the eggs for the seven wonderful children that looked on.,[CLS] children are unaware the penguins blow up balloons,1,0,0,0.3684210526315789,0.5555555555555556,241.48362731933594,190.37608337402344,0.9954670133884065,0.9325911464984529
67,three women sit together near woven walls.,three women sit together.,three bodies appear together in rocky walls.,12 women sit together.,1,0,0,0.5,0.2,294.38177490234375,323.52252197265625,0.9983563325222349,0.9989555380161619
68,"a young gymnast looks back at the audience, trying to catch a glimpse of her proud parents before starting her performance.",a gymnast scanning a crowd for familiar faces.,"a young robin looks up to the sky, trying to catch a glimpse of her long wilderness before starting her journey.",a nurse reads a prayer for smiling faces.,2,0,0,0.30434782608695654,0.4444444444444444,72.4935302734375,82.27357482910156,0.9983842226210982,0.9984301181975752
69,a fireman searching for something using a flashlight.,a fireman is in the dark.,a fireman'for help using a machine.,[CLS] fireman is in the cockpit.,2,0,0,0.5555555555555556,0.5714285714285714,96.43540954589844,138.55809020996094,0.8346482822671533,0.9931502053514123
70,a male with a prosthetic leg diving for a volleyball.,the male has at least one prosthetic leg.,a ship with a prosthetic leg except for a landfall.,[CLS] male has issue a six quadsthetic leg.,1,2,2,0.2727272727272727,0.7777777777777778,278.8905334472656,63.232967376708984,0.9793258234858513,0.98200773447752
71,a man sits at a table in a room.,a man sits.,a girl looks at a table in a room.,she man sits.,1,0,0,0.2,0.25,83.26998138427734,58.100948333740234,0.9991926426664577,0.5623512739912258
72,violin soloists take the stage during the orchestra's opening show at the theater.,people are playing violin on stage.,supporting dancers take the stage during the orchestra's opening show at the end.,alone are the fairies on stage.,1,0,0,0.2,0.42857142857142855,101.7343521118164,120.7817153930664,0.99309645104222,0.9977437655907124
73,women in costume stand on a stage.,the women are on stage.,men in costume appear on a stage.,[CLS] <'only tour.,1,0,0,0.25,1.1666666666666667,471.91949462890625,78.79266357421875,0.9862011131335748,0.9912894424487604
74,"a race car, numbered 104 is rounding a bend as two people watch and take pictures.",people are taking pictures.,"a police car, no, is guarding a bar where two people appear and take cover.",people are drawing pictures.,1,0,0,0.4444444444444444,0.2,244.6981201171875,128.97593688964844,0.8480934523977339,0.9970124983228743
75,two young boys are playing in a fountain in a city plaza.,kids are are standing in a fountain.,two different sets are represented in a statue in a city park.,emperors are are seated in a fountain.,1,0,0,0.38461538461538464,0.25,103.9070816040039,139.74041748046875,0.9888042006641626,0.9919293317943811
76,two young ladies walking down the street together.,"there are two woman in this picture, and they are both outside.",two different boys found down the back fascinated.,"there are two women in a bar, and they are both married.",1,0,0,0.5555555555555556,0.2857142857142857,25.453989028930664,157.73214721679688,0.929150404255779,0.9948018806389882
77,"one young boy in a yellow long - sleeved shirt and jeans sitting down, with five adults in front of him, one operating a video camera.",an adult using a video camera.,"one young boy in a gray shirt, sleeved shirt and jeans sitting down, with the sidewalk in front of him, zebra operating a camera camera.",an idol throwing a handheld camera.,1,0,0,0.2413793103448276,0.42857142857142855,76.95154571533203,68.21044158935547,0.9850244577974081,0.9876380618661642
