,orig_premise,orig_hypothesis,adv_premise,adv_hypothesis,orig_label,adv_label
118,"a crowd of people in a stadium decked out in white, yellow and green cheer and clap for the team below.",a crwod is cheering,"a number of people in a stadium steeped up in white, yellow and green hedges and waiting for the team below.",a crwod is cheering,1,2
119,"two sweet young girls on ice skates, hands up and holding on to each other get ready to begin their performance on the ice.",two females holding each other.,"two very young passengers on ice skates, holding up and holding on to each other while ready to begin their life on the ice.",two females holding each other.,1,2
120,a man in a short mohawk and beard.,a man with a short mohawk and beard stands outside.,a man in a bar dress and affection.,a man with a short mohawk and beard stands outside.,2,0
121,a woman in a pink top is holding a glass bottle in one hand and a stitch doll in the other.,the top is pink,a man in a cage top hat holding a wine bottle in one hand and a jewel bottle in the other.,the top is pink,1,0
122,a girl in a black skirt and blue dress is watering flowers.,the girl is giving the flowers some water.,a girl in a white dress and red dress is eating candles.,the girl is giving the flowers some water.,1,0
123,a pro - baseball pitcher sends a curve ball to his opponent while many fans relax and enjoy the game.,a pitcher is playing baseball at a stadium,a statue - trough pitcher sells a combat ball to his opponent. many are smiling and enjoy the game.,a pitcher is playing baseball at a stadium,1,2
124,one confused man is standing and staring off into the distance in front of some ticket collecting machines.,the man is confused.,one masked man is standing and staring out into the distance in front of a mirror sales machines.,the man is confused.,1,2
125,several men in black t - shirts and caps are using with metal rods to smash food that's lying on a round table with a hole in the center.,men using metal rods,"the men in black boots, cables and jackets are worn with matching rods to catch food that's located on a pool table with a hole in the center.",men using metal rods,1,2
126,a group of people sitting and knitting.,people are sitting.,a group of people are and walking.,people are sitting.,1,0
127,an older man sifts water through his fingers as a young toddler watches from inside the water.,a man is near a toddler,"an old man earned hails clouds through his body, a sign nutler watches from inside the home.",a man is near a toddler,1,2
128,"while traveling, a woman in a black jacket is resting on the shoulder of a man in a black jacket.",a woman rests on the shoulder of a man,"while dancing, a woman in a black jacket is hurled on the shoulder of a man with a black jacket.",a woman rests on the shoulder of a man,1,0
129,"a small, pale bird bends down to examine a crumb.",the bird is on the ground.,"a small, hooked bird leans down to middle a crestan.",the bird is on the ground.,2,0
130,a man riding a motorcycle on a dirt road passing several junk or abandoned cars on the side of the road.,a man is riding a motorcyle.,a man driven a car on a busy road passes several abandoned or abandoned cars on the side of the road.,a man is riding a motorcyle.,1,0
131,a skier is heading into a grove of trees.,there is snow on the ground in this picture.,the suit is etched into a pool of flowers.,there is snow on the ground in this picture.,1,0
132,two women bend over to touch a small kangaroo.,two women are petting a kangaroo,the men heads up to touch a large stream.,two women are petting a kangaroo,2,0
133,a man with thinning hair looking into glasses through glasses.,a man with thinning hair.,a girl with thin new hair transitioned into venus in this.,a man with thinning hair.,1,0
134,a kid dressed in a long - sleeve shirt with a jersey numbered 11 is passing a bar to a boy in a jersey numbered 12 during a relay race.,a team of youths race to finish first in a relay race on a beach.,a boy dressed in a long black plaid shirt with a matching numbered 11 is passing the bar to a boy in a jersey numbered 11 during a relay race.,a team of youths race to finish first in a relay race on a beach.,2,2
135,a man is riding a bicycle in the street.,a bicycle is being ridden,a photograph is just a bicycle in the house.,a bicycle is being ridden,1,0
136,a woman with a pink purse walks down a crowded sidewalk.,a woman walks through a crowd,a man with a pink dress sits on a green sidewalk.,a woman walks through a crowd,1,0
137,"a large number of people are watching men dressed in kilts, one of whom has thrown a long pole.",people watch men in kilts,"a large number of animals are useful, dressed in camouflagelts, one of whom has been a dress pole.",people watch men in kilts,1,0
138,"two babies, one in red, asleep in their highchairs.",babies are asleep,"two guards, one in each, glow in their high shiners.",babies are asleep,1,0
139,some folks pick out the food they want at a party.,the party - goers are perusing the buffet.,some friends give them the tasks they want at a party.,the party - goers are perusing the buffet.,2,2
140,a small dog runs to catch a ball.,a little dog chases a ball.,a little person born to throw a ball.,a little dog chases a ball.,1,0
141,a white and black spotted dog is running through a grassy area.,a dog is outdoors.,a white and cream chin dog is styled with a triangle area.,a dog is outdoors.,1,2
142,the black woman is laying out literature.,a black woman is handling printed material.,the black emperor is inside out poison.,a black woman is handling printed material.,1,0
143,island native fishermen reeling in their nets after a long day's work.,the men are finishing their day of work.,"the shuttle weaving slowly in the bushes with a long day's work,",the men are finishing their day of work.,1,2
144,a dog jumps over the pole.,dog is jumping over a pole,a scene occurs over the end.,dog is jumping over a pole,1,2
145,a man running in a race passes by spectators.,a man is running by people who are watching.,a man running in a car passes by trees.,a man is running by people who are watching.,1,2
146,a man talks to two guards as he holds a drink.,the prisoner is talking to two guards in the prison cafeteria.,a man oblivious to two snakes who he holds a gun.,the prisoner is talking to two guards in the prison cafeteria.,2,0
147,a woman with a black purse and a red coat is sitting on a pillar of concrete.,the woman is waiting for her boyfriend at the local bus stop.,a girl with a red dress and a red roof is sitting on a stack of fire.,the woman is waiting for her boyfriend at the local bus stop.,2,0
148,"one man wearing a pink and blue striped shirt, work gloves, and holding a yellow hard hat.",a tall person in a shirt,"one man wearing a pink and white striped shirt, denim parody, and holding a black mini hat.",a tall person in a shirt,2,2
149,a barber in a sports themed barber shop waits for his next customer to arrive.,a barber in a sports shop waits eagerly for business.,a barber in a french themed barber shop waits for his work ready to visit.,a barber in a sports shop waits eagerly for business.,2,0
150,"boy in backpack crossing the street, other people, all asian, are all in crosswalk walking towards the boy.",the boy is on his way home from school.,"boy in action into the crowd, other people, and warriors, are all in bar brawls towards the boy.",the boy is on his way home from school.,2,0
151,the cyclist rides on a wooded path.,the cyclist rides with a companion on a wooded path,the gang rides on a wooded path.,the cyclist rides with a companion on a wooded path,2,0
152,a woman working in the storefront of a jewelry shop fixing the display shelf.,the woman is dreaming of a modeling career while working in the jewelry shop.,a woman working in the backroom of a printing shop serves the mail service.,the woman is dreaming of a modeling career while working in the jewelry shop.,2,0
153,two people play horseshoes.,tom and sue were playing outside.,twosome play ashores.,tom and sue were playing outside.,2,1
154,two adult men in black t - shirt and loud tunics hold smoking torches in preparation for an act of entertainment or celebration in a forested environment.,two brothers hold torches to celebrate.,two fathers twin in black leather dress shirt and white tunics wear dance candles in preparation for their act of entertainment and celebration in a religious environment.,two brothers hold torches to celebrate.,2,1
155,several adults look on while a young girl plays in a ball pit.,a young girl is having fun.,the scarcely thrive on while a young girl like in a ball game.,a young girl is having fun.,2,1
156,a girl climbing a chain link fence.,the girl climbs the fence to get to school.,a girl broke a chain link fence.,the girl climbs the fence to get to school.,2,0
157,a man biking down a tunnel.,a man is winning a bike race.,a man jogging in a tunnel.,a man is winning a bike race.,2,0
158,"a smiling man with gray hair and glasses, dressed in black, is sitting in a chair with a music stand in front of him.",this man has an eyesight deficiency.,"a fluorescent man with sharp hair and glasses, dressed in dread, is sitting on a chair with a fruit stand in front of him.",this man has an eyesight deficiency.,2,1
159,three children are shooting guns in the woods.,three children are shooting a deer.,three soldiers are hiding pigs in the woods.,three children are shooting a deer.,2,0
160,four people wearing backpacks walking in a line along a mountain trail.,four people are walking along a mountain trail trying to get down before the storm.,six people finishing commuters walking through the disturbance along a surfing trail.,four people are walking along a mountain trail trying to get down before the storm.,2,0
161,several people talk and drink beer while sitting around a picnic table.,several friends talk and drink beer while sitting around a picnic table.,college members talk and drink cheese while sitting around a dining table.,several friends talk and drink beer while sitting around a picnic table.,2,0
162,a smiling girl slides down a purple slide feet first.,a girl happily uses the equipment at a playground.,a elliott girl strips down a sunset playground stadium alone.,a girl happily uses the equipment at a playground.,1,0
163,a man in a purple and blue shirt and shorts is getting ready to hit a golf ball.,a man is on a golf course.,a man in a gray and blue shirt and shorts is getting ready to hit a breaking ball.,a man is on a golf course.,2,0
164,a man is performing for a group in front of a white house.,the man performed in front of his own house.,a man condemned performing for a slave in front of a white house.,the man performed in front of his own house.,2,0
165,a young man is playing a blue guitar.,a musician practices on his guitar briefly before a concert.,"a young man, playing a trick ball.",a musician practices on his guitar briefly before a concert.,2,0
166,two men help each other cut a sheet of plastic.,two friends help each other by cutting some plastic.,two cousins volunteers each other cut a pound of plastic.,two friends help each other by cutting some plastic.,2,1
167,an old man in a blue shirt and white pants glowers by a glass door.,a man resting outside,the old man in a white jacket and white pants halters in a roadside driveway.,a man resting outside,2,1
168,"a little girl drawing with chalk, on a chalkboard.",a little girl is drawing on the board during class.,"a young girl grading with sixteen, on a chalkboard.",a little girl is drawing on the board during class.,2,1
169,a wet golden retriever is walking through a lake,a wet golden retriever is walking through a lake to find a ball.,a ball sport retriever is sitting through a bat,a wet golden retriever is walking through a lake to find a ball.,2,0
170,a woman is sitting down doing some sort of craft work while another person operates a large wooden loom device in the background.,the woman sitting is asian.,"a hen is sitting down in some sort of montana, while the man notices a large reindeer loom flags in the background.",the woman sitting is asian.,2,0
171,people in chairs around a table,the people are eating dinner.,are in dinner after a sixteenth,the people are eating dinner.,2,1
172,a performer plays an instrument for the audience.,the performer is making music.,a performer plays the instrument for the audience.,the performer is making music.,1,1
173,a group of people wait to cross the street in new york,some of the people are wearing sunglasses.,in typical of people fangs to cross the street in new york,some of the people are wearing sunglasses.,2,0
174,"two distinguished older gentlemen stand outside a house, trees in background, both with white hair, the taller man having his arm about the other man's shoulder as they face the camera from behind their corrective lenses.",the older men are colleagues.,"mature years seamen fellows stand outside the house, pale in white, covered with white hair, the outstretched man'his arm around the other man's shoulder. they face the camera from behind their corrective lenses.",the older men are colleagues.,2,1
175,a young woman dressed in black attaches bags full of flowers to a bicycle.,the flowers are lilacs.,a young woman dressed in black chops bags full of sugar to a rainbow.,the flowers are lilacs.,2,0
176,"a man stands on a dock near several boats, while 2 other men are on one of the boats.",a man with brown hair is standing on a dock.,"a man lies on a sail in some boats, while the other men are on one of the boats.",a man with brown hair is standing on a dock.,2,0
177,a bird is perched on a line of some sort attached to a pole.,a bird is wallowing on a pole.,the bird is roared on a line of some sortvation to a pole.,a bird is wallowing on a pole.,2,0
178,a person is on a four wheeler kicking up a lot of dirt in a dune.,the person is in a race.,a person is in a team chasing rounding up a lot of ground in a leisure.,the person is in a race.,2,1
179,"a man wearing an oxford shirt, sunglasses, and a hat smirks.",a man hiding his true identity.,"a man wearing an equal shirt, hat, and a hat commendations.",a man hiding his true identity.,2,0
180,a group of people gathered at night watching an event.,a group of humans are looking at the same direction.,a group of people gathered at night watching an event.,a group of humans are looking at the same direction.,1,1
181,a man in a suit cheering in a library in front of children.,a lawyer is encouraging some children at a contest.,a man in a dress naked in a circus in front of children.,a lawyer is encouraging some children at a contest.,2,0
182,security officer working outside.,a security officer is dressed in a uniform.,valet lashed stationed outside.,a security officer is dressed in a uniform.,2,0
183,a man in a white and gray shirt looks on as a shirtless man with a mustache cleans fish on a pale green table.,the man is cleaning the fish that he caught so he can cook it.,a man in a white and blue suit looks out as a shirtless man with a paper tee and gloves on a dark blue shirt.,the man is cleaning the fish that he caught so he can cook it.,2,0
184,a young couple and many others out enjoying themselves at an outdoor street event.,the young couple are looking at goods being sold by the street vendors.,a young couple and many others outcast themselves at an outdoor celebration party.,the young couple are looking at goods being sold by the street vendors.,2,0
185,construction workers use cables to hang from the sides of buildings.,construction workers are brave.,construction workers use slacks to argue on the sides of ministers.,construction workers are brave.,2,0
186,a dark - haired man in a black uniform is speaking to a man wearing a black jacket and black helmet on a motorbike.,a man in a police uniform is talking to another man.,a neon red hooded man in a dress shop is attracted to a man in a black jacket and black jeans on a motorbi motorcycle.,a man in a police uniform is talking to another man.,2,0
187,a woman wearing a red coat stands on a wood floor in front of several paintings while two girls sit on the floor at her feet.,woman takes a break at a museum while her children sit by her feet.,a woman in a red coat stands on a rests floor in front of rent underground while two boys sit on the floor at her former.,woman takes a break at a museum while her children sit by her feet.,2,1
188,a climber wearing a red headband is pulling himself up some gray rocks high above some green foliage.,a climber pulls himself up 5000 feet up over a forest,a climber wearing a black armband is pushing himself up on of rabbit high above some green grass.,a climber pulls himself up 5000 feet up over a forest,0,0
189,a woman is walking her dog along a snowy ground.,a woman is trying to get her dog to go to the bathroom after it has freshly snowed.,the worker is running the dog through a haunted area.,a woman is trying to get her dog to go to the bathroom after it has freshly snowed.,2,0
190,a boy in a blue uniform is standing next to a boy in red and a boy in yellow and they are holding baseball gloves.,three boys are preparing for their big game that is about to start.,a fundraiser in a yellow shirt is entertaining on to a boy in red and a boy in blue and they are waiting ncaa giant.,three boys are preparing for their big game that is about to start.,2,1
191,"while two students are jumping, others in a classroom are sitting or standing.",two students disrupting class.,"while two freshmen are surged, those in a coach are attacked or standing.",two students disrupting class.,2,1
192,a man alone crosscountry skis in the wilderness while wearing a huge backpack.,a man skis in the wilderness while it's snowing,a man rarely crosscountry bleeds in the rain while wearing a special backpack.,a man skis in the wilderness while it's snowing,2,0
193,a well dressed elderly woman standing in front of a bus decorated with images of purple flowers.,a grandmother is standing in front of a bus with violets decorated all over it.,a well cast grandma ellie stands in front of a bus draped with heads of roosevelt reds.,a grandmother is standing in front of a bus with violets decorated all over it.,2,1
194,two girls kissing a man with a black shirt and brown hair on the cheeks.,two girls kiss there dad.,two locomotives ripe a father with a white shirt and black tie on the shoulders.,two girls kiss there dad.,2,0
195,a large man is sitting in front of a fountain statue while talking on a phone.,the fountain has running water.,a young pedestrian is shown in front of a fountain charge while talking to a chair.,the fountain has running water.,2,1
196,a man puts his hands up while telling an amusing story to his friend with a beard.,the man is perplexed by the events.,"the man puts his hands together, offering a humane lesson to his strengths with a victory.",the man is perplexed by the events.,2,0
197,a man with a tattoo on his arm staring to the side with vehicles and buildings behind him.,a man has dragon tattoos on his arm.,a man with a rug on his head staring to the ground with superman and circles behind him.,a man has dragon tattoos on his arm.,2,0
198,"a man wearing dark knee boots, a green cape, and a hat with two big feathers on the front is sitting by himself on a bench in front of a building with a blue and white patterned piece of wheeled luggage to his right while he rests both his hands on a walking stick.",a man sits by himself at mardi gras.,"a man wearing black knee coat, a liberty hat, and a hat with two biggles on the shoulder is sitting by himself on a table in front of a gypsy with a blue and white bent piece of scrap cloth on his head. he holds both his hands on a live train.",a man sits by himself at mardi gras.,2,0
199,a crowd of people in winter garb gather in the street against a backdrop of bare trees and snow.,it is cold and snowy outside.,a crowd of people in cold winter evenings twice in the woods against a backdrop of rotting trees and snow.,it is cold and snowy outside.,1,1
200,an asian man walks a three - wheeled pedal card fully of white bags.,an asian man walks a three - wheeled pedal card fully of white bags and he can be seen leaving the store.,an asian man shoot a three - wheeled tanaka card out of asian knives.,an asian man walks a three - wheeled pedal card fully of white bags and he can be seen leaving the store.,2,0
201,a couple about to kiss somewhere.,a couple are kissing on new years eve as the ball drops.,the first advises to get ken.,a couple are kissing on new years eve as the ball drops.,2,0
202,a person in an orange shirt reaching up.,a person is reaching up to grab something.,the kid in an orange shirt squeezing up.,a person is reaching up to grab something.,2,1
203,a big dog catches a ball on his nose,a dog is playing with his owner,a gran dog enjoying a ball on his tail,a dog is playing with his owner,2,1
204,an medical worker examines a young girl.,a health worker is evaluating a girl on her sickness.,an aids doctor attendants a young woman.,a health worker is evaluating a girl on her sickness.,2,1
205,there is a man poking a long stick up towards the ceiling.,the man has no arms.,there is a man pointing a long neck up to the ground.,the man has no arms.,0,0
206,a man with two small boys making a purchase from a woman.,the man with the little boys is buying a gift from the woman's store.,the man with two small boys learning a mission from a woman.,the man with the little boys is buying a gift from the woman's store.,2,0
207,a woman standing in front of a large tank at an aquarium turns around to look at the photographer.,a woman wants a new facebook picture of her at the aquarium,a man named in front of a large spotlight at an ambulance dressed up to look out the new.,a woman wants a new facebook picture of her at the aquarium,2,0
208,a woman standing in front of a wall holding a can of bud light with her shirt tied into a semi - halter.,the woman who is shown lives in the south.,a woman standing in front of a gypsy holding a cup of scandinavia cuisine with her hair tied to a jewel and halter.,the woman who is shown lives in the south.,2,0
209,a little boy with an orange backpack walks under a tree through the woods.,a boy walks to school through the woods.,"a little girl in an orange bus "" to a girl in the street.",a boy walks to school through the woods.,2,0
210,a group of people are gathered on a sidewalk in front of a store nearby a littered street.,a group of people are considering whether to shop at the store.,a group of people are put on a dance in front of a fence on a terrorist street.,a group of people are considering whether to shop at the store.,2,0
211,"a man with a blue, collared shirt sits in front of another man.",a man is looking at his friend,"a man with a leather, pocketed shirt shares in his of buddy man.",a man is looking at his friend,2,1
212,"four men in safety gear, one holding a camera, are standing on a platform.",there has been an accident,"two men in tragedy incurred, one holding a camera, one standing on a platform.",there has been an accident,2,1
213,two men climbing on a wooden scaffold.,two sad men climbing on a wooden scaffold.,two men danced on a wooden scaffold.,two sad men climbing on a wooden scaffold.,2,0
214,a group of children in costumes are on a stage with red curtains.,a group of children are performing a play,a number of children in opener are on a macbeth with red hair.,a group of children are performing a play,2,1
215,a red truck is parked next to a burning blue building while a man in a green vest runs toward it.,the burning blue building will turn to dust after an hour.,a red logo is parked next to a mickey blue building. a man in a yellow car runs through it.,the burning blue building will turn to dust after an hour.,2,0
216,a man in a blue jogging suit is running on the sidewalk in front of a painting.,the man is sweating from his run.,a man in a white lung warlord isiated on the floor in front of a puzzle.,the man is sweating from his run.,2,1
217,a band performing at a local bar or club.,the band is playing rock music,a modeling version at a local bar or club.,the band is playing rock music,2,0
218,a group of people are sight seeing and taking pictures.,the group is on vacation,a number of people are officially returning and taking adventure.,the group is on vacation,2,1
219,"a little boy with a shirt, shorts and socks on, standing on the beach.",a boy is watching the ocean.,"a little boy with a shirt, shorts and socks on, singing on the chorus.",a boy is watching the ocean.,2,0
220,"five people standing on a stage, getting ready to perform, who are unrecognizable due to the lack of lighting.","at a rock concert, the audience screams and cries at the handsome singer and his bass guitarist.","the people participate in a theater, getting ready to dance, but are unrecognizable due to the lack of experience.","at a rock concert, the audience screams and cries at the handsome singer and his bass guitarist.",0,0
221,a man with a cowboy hat and a gentleman with sunglasses on his head are seated next to each other.,the very differently dressed men sit next to each other,a man with a special hat and a groom with twinkle on his head are seated next to each other.,the very differently dressed men sit next to each other,0,0
222,expert snowboard is trying a new trick.,the person is snowboarding on top of a mountain.,factory snowboard : irwin a new person.,the person is snowboarding on top of a mountain.,2,0
223,a woman lowering ballast on a boat.,the captain of the boat is preparing for rough waters.,a person still remains in a pool.,the captain of the boat is preparing for rough waters.,2,0
