,orig_premise,orig_hypothesis,adv_premise,adv_hypothesis,orig_label,adv_label
0,a man with a beard is talking on the cellphone and standing next to someone who is lying down on the street.,a man is prone on the street while another man stands next to him.,a man with a hat is relaxing on a cellphone and walks next to someone who is gazing down on the street.,a man is prone on the street while another man stands next to him.,1,0
1,a kid slides down a yellow slide into a swimming pool.,the child slides into the pool.,a foreman drinks down a man slide into a swimming pool.,the child slides into the pool.,1,0
2,a woman talks on a cellphone while sitting in front of blue railings that are in front of the ocean.,she has a conversation on her phone outdoors,a woman comes in a rowanphone while sitting in front of two liness that are in front of the throat.,she has a conversation on her phone outdoors,1,2
3,"a lady, dressed in a costume, is posing with an axe in the middle of the woods.",a lady with an axe is posing in the middle of the woods.,"a masked, dressed in a costume, is seen with an expanse in the middle of the woods.",a lady with an axe is posing in the middle of the woods.,1,2
4,a man in a boom lift bucket welds.,a man is working.,a man in a midtown coat frame marlborough smokes.,a man is working.,1,2
5,"runners in various athletic garb, as well as one individual in a spotted - green dragon costume, run to the right.",runners see a dragon costumed person,"dogs in appropriate athletic garb, as well as one chapter in a japan in green dragon book, ride to the right.",runners see a dragon costumed person,1,0
6,"rider in ceremonial garb rides white arabian horse, also wearing ceremonial blankets and tassels.",the rider and horse are covered in gear.,"depicted in simplest garb ʔ statue vases, and wearing black curls and tassels.",the rider and horse are covered in gear.,1,0
7,"two uniformed women, wearing jackets saying "" politie "" on the back, are looking at each other in front of a crowd.",the women are wearing clothes,"two shave women, a stone inscribed "" tipitie "" on the back, are positioned at each other in front of a table.",the women are wearing clothes,1,2
8,a young man standing outside a laundromat.,a man is standing.,"a special man, at a laundromat.",a man is standing.,1,2
9,two people bicycle on a path separated by small mountains.,two people are riding on bikes outside.,two spheres stands on a wall separated by several hills.,two people are riding on bikes outside.,1,0
10,bubbles surround a statue in the middle of a street.,there are bubbles around the statue.,it is a statue in the middle of the park.,there are bubbles around the statue.,1,2
11,a young boy hanging on a pole smiling at the camera.,the young boy is smiling.,a young boy tattooed on a wall pointing at the camera.,the young boy is smiling.,1,2
12,a man sits on a couch beside a colorful cushion with a pencil in his hand.,the man is holding a pencil.,a man sits on a couch beside a white couch with a bag in his hand.,the man is holding a pencil.,1,0
13,"three men in yellow green safety vests sit on a bench yawning, smoking and having a break.",there are people seated.,"three men in a green jacket shines them on a wall sewning, charging and having a gun.",there are people seated.,1,0
14,"a man in gray on a rocky cliff, overlooking the mountains.",a man can see mountains from where he stands.,"a light in blue on a green swirl, in the attic.",a man can see mountains from where he stands.,1,0
15,a hockey player in blue and red guarding the goal.,a person playing a sport,a taft player in mel and red represent the character.,a person playing a sport,1,2
16,people standing in front of a gray building with a sign that reads'tickets available here '.,the people are standing outside.,people sit in front of a red sofa with a sign that reads'soul lies here '.,the people are standing outside.,1,0
17,a solo shot of a man riding a four wheeler in an atv event.,the man is entered in a event.,a video shot of a man riding a white horse in an avalanche landscape.,the man is entered in a event.,1,2
18,a skier ski - jumping while two other skiers watch his act.,a skier preparing a trick,a psychiatrist achievement in riding while two other skiers watch his act.,a skier preparing a trick,2,0
19,large brown dog walking in shallow water.,a brown dog is walking outside,a hot dog inside in boiling water.,a brown dog is walking outside,1,0
20,a man in a black shirt and brown pants is jumping in the air performing a karate kick towards a man in a red shirt and black hat.,two males are involved in martial arts.,"a sport in a red shirt and white pants, fly in the air performing a fly sax or a woman in a red shirt and black tie.",two males are involved in martial arts.,1,0
21,a guy in glasses is biting into a pink marshmallow chick while somebody else is puckering their lips out wanting a bite.,a man is eating a marshmallow.,a scene in films is kicking into a young marshmallow car while someone else is stretchering their way out using a car.,a man is eating a marshmallow.,1,0
22,a man wearing a red vest is walking past a black and green fence.,a man is wearing a vest.,a group wearing a red hat is walking past a blue and white fence.,a man is wearing a vest.,1,0
23,a young girl with water wings leaps into a crowded pool,there are people in a pool.,a beautiful girl with balloon wings transforms into a outdoor air,there are people in a pool.,1,0
24,a man sitting on steps with a child as a bystander walks by.,a man and a child sitting on steps saw a bystander.,a gig sitting on ten with a sights as a bystander walks by.,a man and a child sitting on steps saw a bystander.,1,0
25,the girl wearing a brown jacket whilst walking in snow.,the girl is walking outside.,the girl becomes a purple dress while dressed in makeup.,the girl is walking outside.,1,0
26,a young woman wearing a yellow shirt and off - white shorts is reading a book while sitting on a park bench.,a woman reading a book while sitting on a bench.,a white man wearing a red shirt and black a white shorts is wearing a book while sitting on a park bench.,a woman reading a book while sitting on a bench.,1,0
27,"an asian woman in a purple shirt preparing a bowl of food for the younger asian boy sitting near buy, while an asian man eats a roll and prepares to take some food up with his chopsticks.",a woman is preparing food for a child.,"an asian man in a white shirt provides a lot of food for the other asian traders sitting on stool, while an asian man eats a lot and seems to take some food off with his chopsticks.",a woman is preparing food for a child.,1,0
28,a woman and child are on a boat and the woman is looking out into the ocean through a scope.,a lady is looking through a scope at the ocean.,a portrait and man are in a boat and the family is looking out into the future through a portal.,a lady is looking through a scope at the ocean.,1,0
29,an indian woman stands in an outdoor marketplace.,a female is outdoors at a bazaar.,an added view appears in an outdoor commercial.,a female is outdoors at a bazaar.,1,2
30,two teen boys in school clothes are walking with something in a garbage bag.,two boys are walking together carrying a bag.,two adolescent boys in school who are hidden in handcuffs in a garbage bag.,two boys are walking together carrying a bag.,1,0
31,"two children, both wearing tan coats, are embracing one another.",two kids are hugging.,"two pairs, both wearing red suits, are eating one another.",two kids are hugging.,1,0
32,a group of consumers walking through a public market to purchase vegetables with the background of the busy store just behind them.,shoppers purchasing vegetables at a busy public market.,a group of queens walking in a public park to pick vegetables with the edge of the field green just behind them.,shoppers purchasing vegetables at a busy public market.,1,0
33,several street vehicles pass by a traditional architecture style of thailand.,vehicles are going down a street in thailand.,several street trams pass by a modernist architecture style of art.,vehicles are going down a street in thailand.,1,2
34,a man wearing a shite short - sleeved shirt kisses a woman wearing a light pink jacket while standing on a public street.,a man is kissing a woman,a man wearing a messe white silk sleeved shirt portrays a man wearing a hot pink shirt while standing on a public square.,a man is kissing a woman,1,0
35,a young woman is wearing a paper crown at an outdoor event.,the woman is outdoors,a young woman is wearing a slit crown at an inappropriate event.,the woman is outdoors,1,2
36,two women look at a table with assorted items on it in some sort of market that others are currently browsing.,two women are looking,two children sit at a table with assorted items on it in some sort of space that others are supposed seeing.,two women are looking,1,0
37,a fat woman wearing faint blue top is blowing soap bubble.,a fat woman is wearing a shirt.,a beautiful woman whose pale blue body is underneath soap bubbles.,a fat woman is wearing a shirt.,2,2
38,a man in a suit driving a horse - drawn buggy down a stone street.,the man is driving a buggy.,a man in a suit holds a horse and a bun. in a city street.,the man is driving a buggy.,1,0
39,expert snowboard is trying a new trick.,the person is snowboarding.,this black music is creating a new genre.,the person is snowboarding.,1,0
40,an asian lady is holding a cup and sitting in front of a table covered in different foods.,there is a table next to a lady.,an intact chef is holding a meal and is in front of a table covered with hard liquids.,there is a table next to a lady.,1,0
41,an asian young woman wearing a white shirt and black pants is holding a pink purse.,the woman is holding a purse.,an attractive young man wearing a white shirt and black pants is wearing a black sweater.,the woman is holding a purse.,1,0
42,a woman wearing a red hat and red bandanna followed by a man in a red bandanna.,the people are wearing bandanas.,a statue has a red bra and red goanna surrounded by a man in a red goanna.,the people are wearing bandanas.,1,0
43,a white man taking a photo in front of water.,a man is in front of water.,a white man has a studio in front of darkness.,a man is in front of water.,1,0
44,a man in a blue jacket holding a handsaw sawing a pipe on top of a wood fence.,someone is sawing.,a man in a leather jacket holding a red and anchoring a bible on top of a wooden fence.,someone is sawing.,1,0
45,a man touching a hanging strand of lamps.,a man is reaching out to a strand of lamps.,a man with a single strand of shadows.,a man is reaching out to a strand of lamps.,1,2
46,dog running with a purple toy in the snowy field.,a dog is running.,horseback running with a white cat in a snowy field.,a dog is running.,1,0
47,two bearded men sit side by side.,two men are sitting down.,two bodies men guards side by side.,two men are sitting down.,1,0
48,two men in karate gear using fighting sticks.,two karate men sparring with sticks,two men in riot gear with cloth under.,two karate men sparring with sticks,1,0
49,man and woman rowing on surfboards third rower in distance.,couples rowing on surfboards.,men and woman rowing on weatherboards for rower in 2012.,couples rowing on surfboards.,2,0
50,a person sweeping stairs in a park.,a person outside.,a person inside chairs in a room.,a person outside.,1,0
51,"four young men stare up at a basketball hoop with no net, in an outdoor, urban basketball court.",four young men looking up at a basketball hoop.,"two young women blow up at a basketball hoop with no net, in an outdoor, outdoor basketball court.",four young men looking up at a basketball hoop.,1,0
52,a solo cyclist is riding down a windy road.,a cyclist rides down a road,a little passengers is walking down a busy road.,a cyclist rides down a road,1,0
53,a person standing next to an old dark building.,a person standing near a building.,a tree sits next to an old log and.,a person standing near a building.,1,0
54,"two hockey players on opposing teams, one in a red and white jersey and one in a blue and black jersey, are standing on the rink.",hockey players are standing on the ice rink.,"two polo players on opposing teams, one in a red and white jersey and one in a blue and black jersey, are standing on the jersey.",hockey players are standing on the ice rink.,1,0
55,a man is playing with his skateboard on a street.,a man is outside.,a girl is now with a fingerboard on a one.,a man is outside.,1,0
56,"a guy on rollerblades, sliding across a rail.",the skateboarder rides the rail.,a cameo on rollerblazers is running over a desert.,the skateboarder rides the rail.,0,0
57,the man white purple and white polka - dotted shirts is eating and looking to his right while the woman behind him has a confused look on her face.,a person is consuming food.,the man wearing black and white striped and striped shirts is brighter and looking to the right and the man behind him has a distant look on her face.,a person is consuming food.,1,0
58,a woman is in the middle of hitting a tennis ball.,a woman is playing tennis.,a woman is in the middle of purchasing a swimming ball.,a woman is playing tennis.,1,0
59,there are two people walking in the sand.,two people walk across the beach.,there are two people walking in the rain.,two people walk across the beach.,2,0
60,a man sitting and a woman laying in his lap kissing each other.,a man sitting and woman laying in his lap.,a man sitting and a woman doing in a wallenary each other.,a man sitting and woman laying in his lap.,1,0
61,an elderly woman with a tan nun uniform on and glasses is taking a picture with her camera.,a woman is in a tan nun uniform.,an elderly woman with a tan chew bottle on his shoulder is wearing a picture with her hands.,a woman is in a tan nun uniform.,1,0
62,four women standing around a yellow table are looking at laptops.,a group of women looking at laptops together.,two images inscribed on a human table are found at æs.,a group of women looking at laptops together.,1,0
63,artist on street corner selling his artwork.,someone is selling paintings.,exhibition on street and sells his works.,someone is selling paintings.,2,2
64,a boy dressed for summer in a green shirt and kahki shorts extends food to a reindeer in a petting zoo.,a boy alien dressed for summer in a green shirt and kahki shorts,a boy dressed for an in a green shirt and kabuki shorts ended next to a bird in a bunting zoo.,a boy alien dressed for summer in a green shirt and kahki shorts,0,0
65,a man in a brown shirt and blue shorts walking in droney park.,a man walking in droney park.,a man in a white shirt and blue suit riding in coney park.,a man walking in droney park.,1,0
66,a young man blew up balloons to craft into animals for the seven excited children that looked on.,the children are watching the man blow up balloons,the young man cleaning up posters to organize the eggs for the seven wonderful children that looked on.,the children are watching the man blow up balloons,1,0
67,three women sit together near woven walls.,three women sit together.,three bodies appear together in rocky walls.,three women sit together.,1,0
68,"a young gymnast looks back at the audience, trying to catch a glimpse of her proud parents before starting her performance.",a gymnast scanning a crowd for familiar faces.,"a young robin looks up to the sky, trying to catch a glimpse of her long wilderness before starting her journey.",a gymnast scanning a crowd for familiar faces.,2,0
69,a fireman searching for something using a flashlight.,a fireman is in the dark.,a fireman'for help using a machine.,a fireman is in the dark.,2,0
70,a male with a prosthetic leg diving for a volleyball.,the male has at least one prosthetic leg.,a ship with a prosthetic leg except for a landfall.,the male has at least one prosthetic leg.,1,2
71,a man sits at a table in a room.,a man sits.,a girl looks at a table in a room.,a man sits.,1,0
72,violin soloists take the stage during the orchestra's opening show at the theater.,people are playing violin on stage.,supporting dancers take the stage during the orchestra's opening show at the end.,people are playing violin on stage.,1,0
73,women in costume stand on a stage.,the women are on stage.,men in costume appear on a stage.,the women are on stage.,1,0
74,"a race car, numbered 104 is rounding a bend as two people watch and take pictures.",people are taking pictures.,"a police car, no, is guarding a bar where two people appear and take cover.",people are taking pictures.,1,0
75,two young boys are playing in a fountain in a city plaza.,kids are are standing in a fountain.,two different sets are represented in a statue in a city park.,kids are are standing in a fountain.,1,0
76,two young ladies walking down the street together.,"there are two woman in this picture, and they are both outside.",two different boys found down the back fascinated.,"there are two woman in this picture, and they are both outside.",1,0
77,"one young boy in a yellow long - sleeved shirt and jeans sitting down, with five adults in front of him, one operating a video camera.",an adult using a video camera.,"one young boy in a gray shirt, sleeved shirt and jeans sitting down, with the sidewalk in front of him, zebra operating a camera camera.",an adult using a video camera.,1,0
78,a woman is leaning down while talking to her phone.,a woman is using a phone,a woman is sitting down and listening to her reflection.,a woman is using a phone,1,0
79,a skier goes down a hill with a mountain as a backdrop.,a skier going down a hill.,a volcano goes up a hill with a mountain as a backdrop.,a skier going down a hill.,1,0
80,"women of india performing with blue streamers, in beautiful blue costumes.",indian women perform together in gorgeous costumes,"women of india sculpture with blue streamers, in dark blue water.",indian women perform together in gorgeous costumes,1,0
81,a gymnast is seen defying gravity as she performs an impressive move several feet above the parallel bars.,a gymanst performing,a snow is shown defying convention as she performs an elaborate song several feet above the hotel bars.,a gymanst performing,1,0
82,players from two opposing teams wearing colorful cleats struggle to gain control over a ball on an astroturf field.,the players are playing a sport.,teams are two unionist teams with iron cleats modified to take control over a field on an icturf field.,the players are playing a sport.,1,2
83,a young girl looking down through some leaves from atop a tree.,there is a girl outdoors.,a young man with down on a room. manning a room.,there is a girl outdoors.,1,0
84,a man holding a baby who is petting a pony.,a man with a baby is petting a pony.,a man like a devil who is petting a knife.,a man with a baby is petting a pony.,1,0
85,man in blue shirt yells and points off - camera while a man in a blue shirt and baseball cap watches.,a man is yelling.,sitting in blue jeans colorful and points to the camera while a man in a blue shirt and baseball caps watches.,a man is yelling.,1,0
86,a small child is riding in a red wagon.,a kid is in a wagon.,a small child is styled in a red dress.,a kid is in a wagon.,1,0
87,a man in renaissance clothing is sitting on a brick wall.,the man is in costume,a man in cleaned fabric is sitting on a brick wall.,the man is in costume,1,0
88,a big black dog jumps in the air to catch the tennis ball in his mouth.,a dog is jumping.,a little black man looks in the air to see the cricket ball in his mouth.,a dog is jumping.,1,0
89,two men are boxing in fighting arena.,two men are boxing.,the men are participants in wrestling matches.,two men are boxing.,1,0
90,a wall hung with multicolored crosses is visible behind the group of young men as they converse.,young men are talking,a window interspersed with multicolored windows is visible through the group of young men as they drive.,young men are talking,1,2
91,red - haired female answers questions while sitting at a table for craftzine.,she answers questions while sitting at a table.,red king < < prepare questions while sitting at a table for travel spot.,she answers questions while sitting at a table.,1,0
92,"two men in costumes with fake carrot noses, top hats, sunglasses and white fur coats that contain white electrical lights.",people in costumes,"the men in nets with five visible hands, a hats, jeans and a fur coat that had white optic lights.",people in costumes,1,2
93,a man has wrecked his racing bike in the dirt with five spectators behind a rope.,a man has damaged something.,a photograph is marching his spare bike in the woods with two people on the mountain.,a man has damaged something.,1,2
94,a city street with market vendors and children being pushed in strollers with a large cathedral in the background.,the strollers are moving.,a beautiful street with adequate windows and banks being built in plasterers with a large garden in the background.,the strollers are moving.,1,2
95,two men working on farm equipment that is being pulled by two horses.,the men are working on farm stuff.,the men working on telecommunication equipment that is being pulled by the horses.,the men are working on farm stuff.,1,0
96,woman running in a park while listening to music.,a woman jogging in a park.,others running in a park while listening to music.,a woman jogging in a park.,1,2
97,a man in jeans and a brown shirt jumps high in the air in a living room that has a fireplace and wooden floor.,a guy in brown jumps up in a room with a wood floor,a bomb in jeans and a. grenade hove up in the air in a living room that has a burning and dirt floor.,a guy in brown jumps up in a room with a wood floor,1,0
98,"the blond young man who had been splattered with paint colors of blue, orange, and green held up his camera to take a picture.",a man covered in paint takes a photo.,"the rooted young man who had been sperryed with hair balloons of blue, brown, and green gives up his cameras to take a picture.",a man covered in paint takes a photo.,1,2
99,"one woman with jeans, gray shirt and sandals ; with girl in all pink watching a white ball float in midair.",the shirt is gray.,"a woman with shoes, wearing skirt and sandals, and men in all colours, a white shirt floating in midair.",the shirt is gray.,1,0
100,3 people are shopping in a market.,there are people at a market.,"most, are usable in a small.",there are people at a market.,1,2
101,a man is working in an art studio and is surrounded by art supplies.,a man is working on art.,a woman is working in an advertising studio and is surrounded by loud speakers.,a man is working on art.,1,0
102,the man in black is flying off the full in front of a red fence.,the man is next to the fence.,the man in black is flying off the parade in front of a flaming banner.,the man is next to the fence.,1,0
103,people are hiking up a mountain with no greenery.,the mountain is bare.,they are climbed up the mountain and theminary.,the mountain is bare.,1,0
104,"an old man in a baseball hat and an old woman in a jean jacket are standing outside, but are covered mostly in shadow.",an old woman has a jean jacket.,"an old man in a sniper hat and an old woman in a headguard are standing outside, and are visible only in shadow.",an old woman has a jean jacket.,1,2
105,a patient is being worked on by doctors and nurses.,someone is at the doctor.,a company is being worked on by nurses and nurses.,someone is at the doctor.,1,0
106,a young male wearing a white shirt with a character outlined very darkly.,a young male in a white shirt.,"a large woman without a white shirt, a photograph of and above.",a young male in a white shirt.,1,0
107,a man wearing a white shirt and a blue jeans reading a newspaper while standing,a man is reading a newspaper.,"a scene wearing a red shirt and a blue jeans surrounded a man, standing",a man is reading a newspaper.,1,2
108,a man and woman setup a camera.,two people setup a device,a man and woman detection a child.,two people setup a device,1,0
109,two dogs run across the woods.,the canines run around in the forest.,two canine from across the bridge.,the canines run around in the forest.,1,0
110,a man is kayaking in rough waters.,the man is in a boat,the man is snowboarding in polar waters.,the man is in a boat,1,0
111,"a person wearing a straw hat, standing outside working a steel apparatus with a pile of coconuts on the ground.",a person is near a pile of coconuts.,"a person wearing a straw hat, standing outside at a small door with a pile of straws on the ground.",a person is near a pile of coconuts.,1,0
112,several men at a bar watch a sports game on the television.,some men are watching tv at a bar.,the men in a neighborhood watch a football game on the streets.,some men are watching tv at a bar.,1,0
113,a lit girl splashes around in natural water.,a girl splashes in water.,a human person splashes around in the water.,a girl splashes in water.,1,2
114,a boy is riding down the road between two cows.,"a boy, a road and two cows.",a sign is placed on the ground between two wings.,"a boy, a road and two cows.",1,0
115,a group of attentive students are paying attention to a college lecture.,some students are attending a class.,a number of attentive people are paying attention to a red rug.,some students are attending a class.,1,2
116,a man laughing while at a restaurant.,a man laughing.,a man smelling while at a restaurant.,a man laughing.,1,0
117,a woman wearing a yellow tank top and white pants looking into a window on a city street.,a woman wearing a tank top and pants looks through some glass.,a person wearing a red crop top and white pants looks shoot a block on a city street.,a woman wearing a tank top and pants looks through some glass.,1,0
